UniProt AC,Database,Gene ID,Record Name,Amino Acids,Keywords,SimChrom
O14964,BioGRID,HGS_HUMAN,Hepatocyte growth factor-regulated tyrosine kinase substrate,777,3D-structure; Acetylation; Alternative splicing; Cytoplasm; Endosome;Membrane; Metal-binding; Phosphoprotein; Protein transport;Reference proteome; Transport; Ubl conjugation; Zinc; Zinc-finger.,
Q9UMN6,Gene Ontology,KMT2B_HUMAN,Histone-lysine N-methyltransferase 2B,2715,3D-structure; Acetylation; Chromatin regulator; Disease variant;DNA-binding; Dystonia; Intellectual disability; Isopeptide bond;Metal-binding; Methyltransferase; Nucleus; Phosphoprotein;Reference proteome; Repeat; S-adenosyl-L-methionine; Transcription;Transcription regulation; Transferase; Ubl conjugation; Zinc; Zinc-finger.,Histone modification
O75031,BioGRID,HSF2B_HUMAN,Heat shock factor 2-binding protein {ECO:0000305},334,3D-structure; Alternative splicing; Chromosome; Coiled coil; Cytoplasm;Disease variant; Premature ovarian failure; Reference proteome;Ubl conjugation.,DNA repair;DNA recombination;DNA-templated transcription
P62851,BioGRID,RS25_HUMAN,Small ribosomal subunit protein eS25 {ECO:0000303|PubMed:24524803},125,3D-structure; Acetylation; Cytoplasm; Direct protein sequencing;Reference proteome; Ribonucleoprotein; Ribosomal protein.,
P52657,Gene Ontology,T2AG_HUMAN,Transcription initiation factor IIA subunit 2,109,3D-structure; Host-virus interaction; Nucleus; Reference proteome;Transcription; Transcription regulation.,Regulation of transcription;General TFs;DNA-templated transcription
Q01538,Gene Ontology,MYT1_HUMAN,Myelin transcription factor 1,1121,3D-structure; Alternative splicing; Developmental protein; Differentiation;DNA-binding; Metal-binding; Neurogenesis; Nucleus; Reference proteome;Repeat; Transcription; Transcription regulation; Zinc; Zinc-finger.,DNA-binding transcription factors
P55316,Gene Ontology,FOXG1_HUMAN,Forkhead box protein G1,489,3D-structure; Developmental protein; Disease variant; DNA-binding;Intellectual disability; Nucleus; Reference proteome; Transcription;Transcription regulation.,DNA-binding transcription factors
Q9HBU1,Gene Ontology,BARX1_HUMAN,Homeobox protein BarH-like 1,254,3D-structure; Alternative splicing; DNA-binding; Homeobox; Nucleus;Reference proteome; Transcription; Transcription regulation.,DNA-binding transcription factors
P03956,Gene Ontology,MMP1_HUMAN,27 kDa interstitial collagenase,469,3D-structure; Autocatalytic cleavage; Calcium; Collagen degradation;Direct protein sequencing; Disulfide bond; Extracellular matrix;Glycoprotein; Host-virus interaction; Hydrolase; Metal-binding;Metalloprotease; Phosphoprotein; Protease; Reference proteome; Repeat;Secreted; Signal; Zinc; Zymogen.,
P51608,Gene Ontology,MECP2_HUMAN,Methyl-CpG-binding protein 2,486,3D-structure; Acetylation; Alternative splicing; Autism;Autism spectrum disorder; Chromosomal rearrangement; Disease variant;DNA-binding; Intellectual disability; Methylation; Nucleus; Phosphoprotein;Reference proteome; Repeat; Repressor; Transcription;Transcription regulation.,Heterochromatin-associated;Methylated DNA binding
O43298,Gene Ontology,ZBT43_HUMAN,Zinc finger and BTB domain-containing protein 43,467,3D-structure; Acetylation; DNA-binding; Isopeptide bond; Metal-binding;Nucleus; Phosphoprotein; Reference proteome; Repeat; Transcription;Transcription regulation; Ubl conjugation; Zinc; Zinc-finger.,DNA-binding transcription factors
Q9BQ39,BioGRID,DDX50_HUMAN,ATP-dependent RNA helicase DDX50,737,3D-structure; ATP-binding; Helicase; Hydrolase; Isopeptide bond;Nucleotide-binding; Nucleus; Phosphoprotein; Reference proteome;RNA-binding; Ubl conjugation.,
P60900,Gene Ontology,PSA6_HUMAN,Proteasome subunit alpha type-6,246,3D-structure; Acetylation; Alternative splicing; Cytoplasm;Direct protein sequencing; Glycoprotein; Nucleus; Phosphoprotein;Proteasome; Reference proteome.,
P12821,Gene Ontology,ACE_HUMAN,"Angiotensin-converting enzyme, soluble form",1306,3D-structure; Alternative promoter usage; Alternative splicing;Calmodulin-binding; Carboxypeptidase; Cell membrane; Cytoplasm;Direct protein sequencing; Disulfide bond; Glycoprotein; Hydrolase;Membrane; Metal-binding; Metalloprotease; Phosphoprotein; Protease;Reference proteome; Repeat; Secreted; Signal; Transmembrane;Transmembrane helix; Zinc.,
Q9NYK5,BioGRID,RM39_HUMAN,Large ribosomal subunit protein mL39 {ECO:0000303|PubMed:25278503},338,3D-structure; Acetylation; Alternative splicing; Mitochondrion;Reference proteome; Ribonucleoprotein; Ribosomal protein.,
Q9UBB5,Gene Ontology,MBD2_HUMAN,Methyl-CpG-binding domain protein 2 {ECO:0000305},411,3D-structure; Alternative splicing; Chromosome; DNA-binding; Nucleus;Phosphoprotein; Reference proteome; Transcription;Transcription regulation.,Chromatin remodelers;Heterochromatin-associated;Methylated DNA binding
P42771,Gene Ontology,CDN2A_HUMAN,Cyclin-dependent kinase inhibitor 2A {ECO:0000312|HGNC:HGNC:1787},156,3D-structure; Acetylation; Alternative splicing; ANK repeat; Cell cycle;Cytoplasm; Disease variant; Li-Fraumeni syndrome; Nucleus; Phosphoprotein;Reference proteome; Repeat; Tumor suppressor.,Heterochromatin-associated
P50914,BioGRID,RL14_HUMAN,Large ribosomal subunit protein eL14 {ECO:0000303|PubMed:24524803},215,3D-structure; Acetylation; Cytoplasm; Direct protein sequencing;Isopeptide bond; Phosphoprotein; Reference proteome; Repeat;Ribonucleoprotein; Ribosomal protein; Triplet repeat expansion;Ubl conjugation.,
Q8NAP3,Gene Ontology,TANGGLKPSV,Zinc finger and BTB domain-containing protein 38,YRNSSYENAR,3D-structure; Activator; Chromosome; DNA-binding; Isopeptide bond;Metal-binding; Nucleus; Phosphoprotein; Reference proteome; Repeat;Repressor; Transcription; Transcription regulation; Ubl conjugation; Zinc;Zinc-finger.,Methylated DNA binding;DNA-binding transcription factors
Q15637,Gene Ontology,SF01_HUMAN,Splicing factor 1,639,3D-structure; Acetylation; Alternative splicing; Direct protein sequencing;Metal-binding; Methylation; mRNA processing; mRNA splicing; Nucleus;Phosphoprotein; Reference proteome; Repressor; RNA-binding; Spliceosome;Transcription; Transcription regulation; Zinc; Zinc-finger.,RNA processing
O43929,Gene Ontology,ORC4_HUMAN,Origin recognition complex subunit 4,436,3D-structure; Alternative splicing; ATP-binding; Disease variant;DNA replication; DNA-binding; Dwarfism; Methylation; Nucleotide-binding;Nucleus; Reference proteome.,DNA replication;Telomere-associated
Q03164,Gene Ontology,KMT2A_HUMAN,MLL cleavage product C180,3969,3D-structure; Acetylation; Alternative splicing; Apoptosis;Biological rhythms; Bromodomain; Chromatin regulator;Chromosomal rearrangement; Direct protein sequencing; DNA-binding;Host-virus interaction; Isopeptide bond; Metal-binding; Methylation;Methyltransferase; Nucleus; Phosphoprotein; Proto-oncogene;Reference proteome; Repeat; S-adenosyl-L-methionine; Transcription;Transcription regulation; Transferase; Ubl conjugation; Zinc; Zinc-finger.,Histone PTM readers;Histone modification;Histone PTM writers;DNA-templated transcription
O60479,Gene Ontology,DLX3_HUMAN,Homeobox protein DLX-3,287,3D-structure; Activator; Amelogenesis imperfecta; Cytoplasm;Developmental protein; DNA-binding; Homeobox; Nucleus; Reference proteome;Transcription; Transcription regulation.,DNA-binding transcription factors
P17096,Gene Ontology,HMGA1_HUMAN,High mobility group protein HMG-I/HMG-Y,107,3D-structure; Acetylation; ADP-ribosylation; Alternative splicing;Chromosomal rearrangement; Chromosome; Direct protein sequencing;DNA-binding; Isopeptide bond; Methylation; Nucleus; Phosphoprotein;Reference proteome; Repeat; Transcription; Transcription regulation;Ubl conjugation.,DNA replication;Heterochromatin-associated;Regulation of transcription;HMG_A/B/N
Q14694,BioGRID,UBP10_HUMAN,Ubiquitin carboxyl-terminal hydrolase 10 {ECO:0000305},798,3D-structure; Acetylation; Alternative splicing; Autophagy; Cytoplasm;DNA damage; DNA repair; Endosome; Hydrolase; Nucleus; Phosphoprotein;Protease; Reference proteome; Thiol protease; Ubl conjugation;Ubl conjugation pathway.,DNA repair
P62877,Gene Ontology,RBX1_HUMAN,"E3 ubiquitin-protein ligase RBX1, N-terminally processed",108,3D-structure; Acetylation; Cytoplasm; Direct protein sequencing;DNA damage; DNA repair; Host-virus interaction; Metal-binding; Nucleus;Phosphoprotein; Reference proteome; Transferase; Ubl conjugation pathway;Zinc; Zinc-finger.,Histone PTM writers
P23771,Gene Ontology,GATA3_HUMAN,Trans-acting T-cell-specific transcription factor GATA-3,443,3D-structure; Activator; Alternative splicing; Deafness; Disease variant;DNA-binding; Immunity; Innate immunity; Metal-binding; Nucleus;Phosphoprotein; Reference proteome; Repeat; Transcription;Transcription regulation; Zinc; Zinc-finger.,DNA-binding transcription factors;DNA-templated transcription;Pioneer TFs
Q9UIF9,Gene Ontology,BAZ2A_HUMAN,Bromodomain adjacent to zinc finger domain protein 2A,1905,3D-structure; Acetylation; Alternative splicing; Bromodomain;Chromatin regulator; Coiled coil; DNA-binding; Isopeptide bond;Metal-binding; Nucleus; Phosphoprotein; Reference proteome; Repeat;Repressor; RNA-binding; Transcription; Transcription regulation;Ubl conjugation; Zinc; Zinc-finger.,Histone PTM readers;Chromatin remodelers;Heterochromatin-associated;DNA-templated transcription
P22413,Gene Ontology,ENPP1_HUMAN,"Ectonucleotide pyrophosphatase/phosphodiesterase family member 1, secreted form {ECO:0000305}",925,3D-structure; Biomineralization; Calcium; Cell membrane; Diabetes mellitus;Direct protein sequencing; Disease variant; Disulfide bond; Glycoprotein;Hydrolase; Membrane; Metal-binding; Obesity; Phosphoprotein;Reference proteome; Repeat; Secreted; Signal-anchor; Transmembrane;Transmembrane helix; Zinc.,
Q13077,Gene Ontology,TRAF1_HUMAN,TNF receptor-associated factor 1,416,3D-structure; Alternative splicing; Apoptosis; Coiled coil;Isopeptide bond; Phosphoprotein; Reference proteome; Ubl conjugation.,
Q6P179,Gene Ontology,ERAP2_HUMAN,Endoplasmic reticulum aminopeptidase 2,960,3D-structure; Adaptive immunity; Alternative splicing; Aminopeptidase;Disulfide bond; Endoplasmic reticulum; Glycoprotein; Hydrolase; Immunity;Membrane; Metal-binding; Metalloprotease; Protease; Reference proteome;Signal-anchor; Transmembrane; Transmembrane helix; Zinc.,
Q8IUQ4,Gene Ontology,SIAH1_HUMAN,E3 ubiquitin-protein ligase SIAH1,282,3D-structure; Alternative splicing; Apoptosis; Cell cycle; Cytoplasm;Developmental protein; Differentiation; Disease variant;Intellectual disability; Metal-binding; Nucleus; Phosphoprotein;Reference proteome; Spermatogenesis; Transferase; Ubl conjugation pathway;Zinc; Zinc-finger.,
Q9UQL6,Gene Ontology,HDAC5_HUMAN,Histone deacetylase 5,1122,3D-structure; Acetylation; Alternative splicing; Chromatin regulator;Cytoplasm; Hydrolase; Isopeptide bond; Metal-binding; Nucleus;Phosphoprotein; Reference proteome; Repressor; Transcription;Transcription regulation; Ubl conjugation; Zinc.,Histone modification;Histone PTM erasers
Q92831,Gene Ontology,KAT2B_HUMAN,Histone acetyltransferase KAT2B,832,3D-structure; Activator; Acyltransferase; Biological rhythms; Bromodomain;Cell cycle; Cytoplasm; Cytoskeleton; Disease variant;Host-virus interaction; Nucleus; Reference proteome; Transcription;Transcription regulation; Transferase.,Histone modification;Histone PTM writers;Centromere-associated;DNA-templated transcription
P26358,Gene Ontology,DNMT1_HUMAN,DNA (cytosine-5)-methyltransferase 1,1616,3D-structure; Acetylation; Activator; Alternative splicing;Chromatin regulator; Deafness; Disease variant; DNA-binding;Isopeptide bond; Metal-binding; Methylation; Methyltransferase; Neuropathy;Nucleus; Phosphoprotein; Reference proteome; Repeat; Repressor;S-adenosyl-L-methionine; Transcription; Transcription regulation;Transferase; Ubl conjugation; Zinc; Zinc-finger.,Centromere-associated;Heterochromatin-associated;DNA-modifying enzymes;DNA de_methylation;Methylated DNA binding
Q13105,Gene Ontology,ZBT17_HUMAN,Zinc finger and BTB domain-containing protein 17,803,3D-structure; Alternative splicing; Developmental protein; DNA-binding;Isopeptide bond; Metal-binding; Nucleus; Phosphoprotein;Reference proteome; Repeat; Transcription; Transcription regulation;Ubl conjugation; Zinc; Zinc-finger.,DNA-binding transcription factors
Q96SN8,Gene Ontology,CK5P2_HUMAN,CDK5 regulatory subunit-associated protein 2,1893,3D-structure; Alternative splicing; Calmodulin-binding; Cytoplasm;Cytoskeleton; Golgi apparatus; Intellectual disability; Microtubule;Phosphoprotein; Primary microcephaly; Reference proteome.,
Q7Z353,Gene Ontology,HDX_HUMAN,Highly divergent homeobox,690,3D-structure; Alternative splicing; Direct protein sequencing; DNA-binding;Homeobox; Isopeptide bond; Nucleus; Reference proteome; Repeat;Ubl conjugation.,DNA-binding transcription factors
Q86YT6,Gene Ontology,MIB1_HUMAN,E3 ubiquitin-protein ligase MIB1,1006,3D-structure; ANK repeat; Cardiomyopathy; Cell membrane; Coiled coil;Cytoplasm; Cytoskeleton; Disease variant; Membrane; Metal-binding;Notch signaling pathway; Phosphoprotein; Reference proteome; Repeat;Transferase; Ubl conjugation; Ubl conjugation pathway; Zinc; Zinc-finger.,
Q92785,BioGRID,REQU_HUMAN,Zinc finger protein ubi-d4,391,3D-structure; Acetylation; Alternative splicing; Apoptosis;Chromatin regulator; Cytoplasm; Disease variant; Intellectual disability;Isopeptide bond; Metal-binding; Nucleus; Phosphoprotein;Reference proteome; Repeat; Transcription; Transcription regulation;Ubl conjugation; Zinc; Zinc-finger.,Histone PTM readers;Chromatin remodelers
Q2Y0W8,Gene Ontology,S4A8_HUMAN,Electroneutral sodium bicarbonate exchanger 1,1093,3D-structure; Alternative splicing; Anion exchange; Antiport;Cell membrane; Coiled coil; Cytoplasmic vesicle; Disulfide bond;Glycoprotein; Ion transport; Membrane; Reference proteome; Sodium;Sodium transport; Synapse; Transmembrane; Transmembrane helix; Transport;Zinc.,
P26639,Gene Ontology,SYTC_HUMAN,"Threonine--tRNA ligase 1, cytoplasmic {ECO:0000305}",723,3D-structure; Acetylation; Alternative splicing; Aminoacyl-tRNA synthetase;ATP-binding; Cytoplasm; Disease variant; Ligase; Nucleotide-binding;Phosphoprotein; Protein biosynthesis; Reference proteome; RNA-binding;tRNA-binding; Ubl conjugation.,
P23760,Gene Ontology,PAX3_HUMAN,Paired box protein Pax-3,479,3D-structure; Alternative splicing; Chromosomal rearrangement; Deafness;Developmental protein; Disease variant; DNA-binding; Homeobox; Myogenesis;Neurogenesis; Nucleus; Paired box; Phosphoprotein; Proto-oncogene;Reference proteome; Transcription; Transcription regulation;Waardenburg syndrome.,DNA-binding transcription factors
Q8IX15,Gene Ontology,HOMEZ_HUMAN,Homeobox and leucine zipper protein Homez,550,3D-structure; Alternative splicing; DNA-binding; Homeobox; Isopeptide bond;Nucleus; Phosphoprotein; Reference proteome; Repeat; Transcription;Transcription regulation; Ubl conjugation.,DNA-binding transcription factors
O00327,Gene Ontology,BMAL1_HUMAN,Basic helix-loop-helix ARNT-like protein 1 {ECO:0000312|HGNC:HGNC:701},626,3D-structure; Acetylation; Activator; Alternative splicing;Biological rhythms; Cytoplasm; DNA-binding; Isopeptide bond; Nucleus;Phosphoprotein; Reference proteome; Repeat; Transcription;Transcription regulation; Ubl conjugation.,Regulation of transcription;DNA-binding transcription factors
P00441,Gene Ontology,SODC_HUMAN,Superoxide dismutase [Cu-Zn] {ECO:0000305},154,3D-structure; Acetylation; Amyotrophic lateral sclerosis; Antioxidant;Copper; Cytoplasm; Direct protein sequencing; Disease variant;Disulfide bond; Lipoprotein; Metal-binding; Neurodegeneration; Nucleus;Oxidoreductase; Palmitate; Phosphoprotein; Reference proteome;Ubl conjugation; Zinc.,
Q06710,Gene Ontology,PAX8_HUMAN,Paired box protein Pax-8,450,3D-structure; Alternative splicing; Congenital hypothyroidism;Developmental protein; Differentiation; Disease variant; DNA-binding;Nucleus; Paired box; Phosphoprotein; Reference proteome; Transcription;Transcription regulation.,DNA-binding transcription factors
Q01196,Gene Ontology,RUNX1_HUMAN,Runt-related transcription factor 1,453,3D-structure; Acetylation; Activator; Alternative splicing; Chloride;Chromosomal rearrangement; Disease variant; DNA-binding; Methylation;Nucleus; Phosphoprotein; Proto-oncogene; Reference proteome; Repressor;Transcription; Transcription regulation.,Regulation of transcription;DNA-binding transcription factors
Q08257,Gene Ontology,QOR_HUMAN,Quinone oxidoreductase,329,3D-structure; Acetylation; Alternative splicing; Cytoplasm; NADP;Oxidoreductase; Phosphoprotein; Reference proteome; RNA-binding.,
Q14587,Gene Ontology,ZN268_HUMAN,Zinc finger protein 268,947,3D-structure; Alternative splicing; Cytoplasm; Differentiation;DNA-binding; Metal-binding; Nucleus; Reference proteome; Repeat; Repressor;Transcription; Transcription regulation; Zinc; Zinc-finger.,DNA-binding transcription factors
P50591,Gene Ontology,TNF10_HUMAN,Tumor necrosis factor ligand superfamily member 10,281,3D-structure; Alternative splicing; Apoptosis; Cell membrane; Cytokine;Membrane; Metal-binding; Phosphoprotein; Reference proteome; Secreted;Signal-anchor; Transmembrane; Transmembrane helix; Zinc.,
P52943,Gene Ontology,CRIP2_HUMAN,Cysteine-rich protein 2,208,3D-structure; Acetylation; Alternative splicing; LIM domain; Metal-binding;Phosphoprotein; Reference proteome; Repeat; Zinc.,
P54132,Gene Ontology,BLM_HUMAN,RecQ-like DNA helicase BLM {ECO:0000305},1417,3D-structure; Acetylation; ATP-binding; Disease variant; DNA damage;DNA repair; DNA replication; DNA-binding; Dwarfism; Helicase; Hydrolase;Isomerase; Isopeptide bond; Metal-binding; Nucleotide-binding; Nucleus;Phosphoprotein; Reference proteome; Ubl conjugation; Zinc.,DNA replication;DNA repair;Telomere-associated;DNA-modifying enzymes
Q13469,Gene Ontology,NFAC2_HUMAN,"Nuclear factor of activated T-cells, cytoplasmic 2",925,3D-structure; Activator; Alternative splicing; Cytoplasm; DNA-binding;Nucleus; Phosphoprotein; Reference proteome; Repeat; Transcription;Transcription regulation; Ubl conjugation.,Regulation of transcription;DNA-binding transcription factors;DNA-templated transcription
Q14684,BioGRID,RRP1B_HUMAN,Ribosomal RNA processing protein 1 homolog B,758,3D-structure; Acetylation; Activator; Alternative splicing; Apoptosis;Chromosome; Citrullination; Host-virus interaction; mRNA processing;mRNA splicing; Nucleus; Phosphoprotein; Reference proteome; Transcription;Transcription regulation.,Euchromatin-associated;Heterochromatin-associated
P19484,Gene Ontology,TFEB_HUMAN,Transcription factor EB {ECO:0000303|PubMed:2115126},476,3D-structure; Activator; Adaptive immunity; Alternative splicing;Autophagy; Cytoplasm; DNA-binding; Immunity; Lysosome; Membrane; Nucleus;Phosphoprotein; Reference proteome; Transcription;Transcription regulation; Ubl conjugation.,DNA-binding transcription factors
P49591,Gene Ontology,SYSC_HUMAN,"Serine--tRNA ligase, cytoplasmic",514,3D-structure; Acetylation; Aminoacyl-tRNA synthetase; ATP-binding;Cytoplasm; Disease variant; DNA-binding; Epilepsy; Intellectual disability;Ligase; Nucleotide-binding; Nucleus; Phosphoprotein; Protein biosynthesis;Reference proteome; Transcription; Transcription regulation.,
Q8IWU4,Gene Ontology,ZNT8_HUMAN,Proton-coupled zinc antiporter SLC30A8 {ECO:0000305|PubMed:32723473},369,3D-structure; Alternative splicing; Antiport; Cell membrane;Cytoplasmic vesicle; Diabetes mellitus; Ion transport; Membrane;Metal-binding; Reference proteome; Transmembrane; Transmembrane helix;Transport; Zinc; Zinc transport.,
O95238,Gene Ontology,SPDEF_HUMAN,SAM pointed domain-containing Ets transcription factor,335,3D-structure; Activator; Alternative splicing; DNA-binding; Nucleus;Reference proteome; Transcription; Transcription regulation.,DNA-binding transcription factors;DNA-templated transcription
P55345,Gene Ontology,ANM2_HUMAN,Protein arginine N-methyltransferase 2,433,3D-structure; Alternative splicing; Cytoplasm; Methylation;Methyltransferase; Nucleus; Reference proteome; S-adenosyl-L-methionine;SH3 domain; Transferase.,Histone modification;Histone PTM writers
P67809,Gene Ontology,YBOX1_HUMAN,Y-box-binding protein 1 {ECO:0000303|PubMed:10817758},324,3D-structure; Acetylation; Activator; Cytoplasm; Direct protein sequencing;DNA-binding; Isopeptide bond; Mitogen; mRNA processing; mRNA splicing;Nucleus; Phosphoprotein; Reference proteome; Repressor; RNA-binding;Secreted; Transcription; Transcription regulation; Ubl conjugation.,RNA processing
Q12772,Gene Ontology,SRBP2_HUMAN,Processed sterol regulatory element-binding protein 2 {ECO:0000305},1141,3D-structure; Activator; Alternative splicing; Cholesterol metabolism;Cytoplasmic vesicle; Direct protein sequencing; DNA-binding;Endoplasmic reticulum; Golgi apparatus; Isopeptide bond; Lipid metabolism;Membrane; Nucleus; Phosphoprotein; Reference proteome; Steroid metabolism;Sterol metabolism; Transcription; Transcription regulation; Transmembrane;Transmembrane helix; Ubl conjugation.,DNA-binding transcription factors
P84098,BioGRID,RL19_HUMAN,Large ribosomal subunit protein eL19 {ECO:0000303|PubMed:24524803},196,3D-structure; Citrullination; Cytoplasm; Direct protein sequencing;Isopeptide bond; Phosphoprotein; Reference proteome; Ribonucleoprotein;Ribosomal protein; Ubl conjugation.,
Q9NZV6,Gene Ontology,MSRB1_HUMAN,Methionine-R-sulfoxide reductase B1,116,3D-structure; Cytoplasm; Cytoskeleton; Immunity; Innate immunity;Metal-binding; Nucleus; Oxidoreductase; Reference proteome; Selenocysteine;Ubl conjugation; Zinc.,
P23769,Gene Ontology,GATA2_HUMAN,Endothelial transcription factor GATA-2,480,3D-structure; Activator; Alternative splicing; Disease variant;DNA-binding; Isopeptide bond; Metal-binding; Methylation; Nucleus;Phagocytosis; Phosphoprotein; Reference proteome; Repeat; Transcription;Transcription regulation; Ubl conjugation; Zinc; Zinc-finger.,DNA-binding transcription factors;DNA-templated transcription;Pioneer TFs
Q15650,Gene Ontology,TRIP4_HUMAN,Activating signal cointegrator 1 {ECO:0000303|PubMed:10454579},581,3D-structure; Acetylation; Congenital muscular dystrophy; Cytoplasm;Cytoskeleton; Isopeptide bond; Metal-binding; Neurodegeneration; Nucleus;Phosphoprotein; Reference proteome; Transcription;Transcription regulation; Ubl conjugation; Zinc; Zinc-finger.,Regulation of transcription
P43268,Gene Ontology,ETV4_HUMAN,ETS translocation variant 4,484,3D-structure; Activator; Alternative splicing; DNA-binding;Isopeptide bond; Nucleus; Phosphoprotein; Reference proteome;Transcription; Transcription regulation; Ubl conjugation.,DNA-binding transcription factors
P52948,Gene Ontology,NUP98_HUMAN,Nuclear pore complex protein Nup96,1817,3D-structure; Acetylation; Alternative splicing; Autocatalytic cleavage;Chromosomal rearrangement; Direct protein sequencing;Host-virus interaction; Hydrolase; Isopeptide bond; Membrane;mRNA transport; Nuclear pore complex; Nucleus; Phosphoprotein; Protease;Protein transport; Reference proteome; Repeat; Serine protease;Translocation; Transport; Ubl conjugation.,Centromere-associated;Telomere-associated
O95271,Gene Ontology,TNKS1_HUMAN,Poly [ADP-ribose] polymerase tankyrase-1 {ECO:0000305},1327,3D-structure; ADP-ribosylation; Alternative splicing; ANK repeat;Cell cycle; Cell division; Chromosome; Cytoplasm; Cytoskeleton;Glycosyltransferase; Golgi apparatus; Membrane; Metal-binding; Mitosis;mRNA transport; NAD; Nuclear pore complex; Nucleotidyltransferase; Nucleus;Phosphoprotein; Protein transport; Reference proteome; Repeat; Telomere;Transferase; Translocation; Transport; Ubl conjugation;Wnt signaling pathway; Zinc.PLHEA AQKGRTQLCA LLLAHGADPT MKNQEGQTPL DLATADDIRA LLIDAMPPEA,Telomere-associated
O95639,Gene Ontology,CPSF4_HUMAN,Cleavage and polyadenylation specificity factor subunit 4,269,3D-structure; Alternative splicing; Host-virus interaction; Metal-binding;mRNA processing; Nucleus; Phosphoprotein; Reference proteome; Repeat;RNA-binding; Zinc; Zinc-finger.,
Q07869,Gene Ontology,PPARA_HUMAN,Peroxisome proliferator-activated receptor alpha,468,3D-structure; Activator; Alternative splicing; Biological rhythms;DNA-binding; Lipid-binding; Metal-binding; Nucleus; Receptor;Reference proteome; Transcription; Transcription regulation; Zinc;Zinc-finger.,Nuclear hormone receptors;DNA-binding transcription factors
Q13822,Gene Ontology,ENPP2_HUMAN,Ectonucleotide pyrophosphatase/phosphodiesterase family member 2,863,3D-structure; Alternative splicing; Calcium; Chemotaxis;Cleavage on pair of basic residues; Direct protein sequencing;Disulfide bond; Glycoprotein; Hydrolase; Lipid degradation;Lipid metabolism; Metal-binding; Obesity; Reference proteome; Repeat;Secreted; Signal; Zinc.,
P07327,Gene Ontology,ADH1A_HUMAN,Alcohol dehydrogenase 1A,375,3D-structure; Acetylation; Cytoplasm; Direct protein sequencing;Metal-binding; NAD; Oxidoreductase; Phosphoprotein; Reference proteome;Zinc.,
P22670,Gene Ontology,RFX1_HUMAN,MHC class II regulatory factor RFX1,979,3D-structure; Activator; DNA-binding; Nucleus; Phosphoprotein;Reference proteome; Transcription; Transcription regulation.,DNA-binding transcription factors
Q5T4S7,Gene Ontology,UBR4_HUMAN,E3 ubiquitin-protein ligase UBR4,5183,3D-structure; Acetylation; Alternative splicing; Calmodulin-binding;Cytoplasm; Cytoskeleton; Direct protein sequencing; Host-virus interaction;Membrane; Metal-binding; Nucleus; Phosphoprotein; Reference proteome;Transferase; Transmembrane; Transmembrane helix; Ubl conjugation pathway;Zinc; Zinc-finger.,
Q03014,Gene Ontology,HHEX_HUMAN,Hematopoietically-expressed homeobox protein HHEX,270,3D-structure; Cytoplasm; Developmental protein; Differentiation;DNA-binding; Homeobox; Nucleus; Phosphoprotein; Reference proteome;Repressor; Transcription; Transcription regulation; Wnt signaling pathway.,DNA-binding transcription factors
