UniProt AC,Database,Gene ID,Record Name,Amino Acids,Keywords,SimChrom
Q93088,Gene Ontology,BHMT1_HUMAN,Betaine--homocysteine S-methyltransferase 1 {ECO:0000303|PubMed:8798461},406,3D-structure; Cytoplasm; Metal-binding; Methyltransferase; Nucleus;Phosphoprotein; Reference proteome; Transferase; Zinc.,
O94993,Gene Ontology,SOX30_HUMAN,Transcription factor SOX-30,753,3D-structure; Activator; Alternative splicing; Cytoplasm; DNA-binding;Nucleus; Reference proteome; Repressor; Transcription;Transcription regulation.,DNA-binding transcription factors
Q9NYG5,Gene Ontology,APC11_HUMAN,Anaphase-promoting complex subunit 11,84,3D-structure; Alternative splicing; Cell cycle; Cell division; Cytoplasm;Metal-binding; Mitosis; Nucleus; Reference proteome; Ubl conjugation;Ubl conjugation pathway; Zinc; Zinc-finger.,
P06703,Gene Ontology,S10A6_HUMAN,Protein S100-A6,90,3D-structure; Acetylation; Calcium; Cell membrane; Cytoplasm;Direct protein sequencing; Membrane; Metal-binding; Nucleus;Phosphoprotein; Reference proteome; Repeat.,
Q13043,Gene Ontology,STK4_HUMAN,Serine/threonine-protein kinase 4 18kDa subunit,487,3D-structure; Acetylation; Alternative splicing; Apoptosis; ATP-binding;Coiled coil; Cytoplasm; Direct protein sequencing; Kinase; Magnesium;Metal-binding; Nucleotide-binding; Nucleus; Phosphoprotein;Reference proteome; Serine/threonine-protein kinase; Transferase.,Histone PTM writers
P41223,Gene Ontology,BUD31_HUMAN,Protein BUD31 homolog {ECO:0000303|PubMed:25091737},144,3D-structure; Acetylation; Alternative splicing; mRNA processing;mRNA splicing; Nucleus; Reference proteome; Spliceosome; Transcription;Transcription regulation.,RNA processing
P62875,Gene Ontology,RPAB5_HUMAN,"DNA-directed RNA polymerases I, II, and III subunit RPABC5",67,3D-structure; DNA-directed RNA polymerase; Metal-binding; Nucleus;Reference proteome; Transcription; Zinc.,RNA polymerases;DNA-templated transcription
P02795,Gene Ontology,MT2_HUMAN,Metallothionein-2,61,3D-structure; Acetylation; Cadmium; Direct protein sequencing;Metal-binding; Metal-thiolate cluster; Phosphoprotein; Reference proteome;Zinc.,
P11387,Gene Ontology,TOP1_HUMAN,DNA topoisomerase 1,765,3D-structure; Acetylation; Biological rhythms; Chromosomal rearrangement;Direct protein sequencing; DNA-binding; Host-virus interaction; Isomerase;Isopeptide bond; Nucleus; Phosphoprotein; Proto-oncogene;Reference proteome; Topoisomerase; Ubl conjugation.,DNA replication;DNA-modifying enzymes
Q8WTR7,Gene Ontology,ZN473_HUMAN,Zinc finger protein 473,871,3D-structure; DNA-binding; Isopeptide bond; Metal-binding; Nucleus;Reference proteome; Repeat; Ubl conjugation; Zinc; Zinc-finger.,DNA-binding transcription factors
Q02548,Gene Ontology,PAX5_HUMAN,Paired box protein Pax-5,391,3D-structure; Alternative splicing; Chromosomal rearrangement;Developmental protein; Differentiation; Disease variant; DNA-binding;Glycoprotein; Neurogenesis; Nucleus; Paired box; Proto-oncogene;Reference proteome; Spermatogenesis; Transcription;Transcription regulation.,DNA-binding transcription factors;DNA-templated transcription
O14497,Gene Ontology,ARI1A_HUMAN,AT-rich interactive domain-containing protein 1A,2285,3D-structure; Acetylation; Alternative splicing; Chromatin regulator;Direct protein sequencing; DNA-binding; Intellectual disability;Methylation; Neurogenesis; Nucleus; Phosphoprotein; Reference proteome;Transcription; Transcription regulation.,Chromatin remodelers;DNA-templated transcription
P43166,Gene Ontology,CAH7_HUMAN,Carbonic anhydrase 7,264,3D-structure; Alternative splicing; Cytoplasm; Lyase; Metal-binding;Reference proteome; Zinc.,
Q8N4Q0,Gene Ontology,PTGR3_HUMAN,Prostaglandin reductase 3,377,3D-structure; Acetylation; Alternative splicing; Lipid metabolism; NADP;Oxidoreductase; Peroxisome; Phosphoprotein; Reference proteome.,
P18146,Gene Ontology,EGR1_HUMAN,Early growth response protein 1 {ECO:0000303|PubMed:2377485},543,3D-structure; Activator; Biological rhythms; Cytoplasm; DNA-binding;Isopeptide bond; Metal-binding; Nucleus; Reference proteome; Repeat;Transcription; Transcription regulation; Ubl conjugation; Zinc;Zinc-finger.,Methylated DNA binding;DNA-binding transcription factors;DNA-templated transcription
P12755,Gene Ontology,SKI_HUMAN,Ski oncogene,728,3D-structure; Coiled coil; Craniosynostosis; Disease variant; Nucleus;Phosphoprotein; Proto-oncogene; Reference proteome; Repeat;Ubl conjugation.,DNA-binding transcription factors
P18848,Gene Ontology,ATF4_HUMAN,Cyclic AMP-dependent transcription factor ATF-4 {ECO:0000305},351,3D-structure; Acetylation; Activator; Biological rhythms; Cell membrane;Coiled coil; Cytoplasm; Cytoskeleton; DNA-binding; Hydroxylation;Isopeptide bond; Membrane; Nucleus; Phosphoprotein; Reference proteome;Repressor; Transcription; Transcription regulation; Ubl conjugation.,Regulation of transcription;DNA-binding transcription factors;DNA-templated transcription
O75419,Gene Ontology,CDC45_HUMAN,Cell division control protein 45 homolog,566,3D-structure; Alternative splicing; Cell cycle; Chromosome;Disease variant; DNA replication; Dwarfism; Nucleus; Phosphoprotein;Reference proteome.,DNA replication;DNA repair
O95863,Gene Ontology,SNAI1_HUMAN,Zinc finger protein SNAI1,264,3D-structure; ADP-ribosylation; Cytoplasm; Developmental protein;DNA-binding; Glycoprotein; Isopeptide bond; Metal-binding; Nucleus;Phosphoprotein; Reference proteome; Repeat; Ubl conjugation; Zinc;Zinc-finger.,Centromere-associated;Heterochromatin-associated;DNA-binding transcription factors
Q92665,BioGRID,RT31_HUMAN,Small ribosomal subunit protein mS31 {ECO:0000303|PubMed:25838379},395,3D-structure; Mitochondrion; Reference proteome; Ribonucleoprotein;Ribosomal protein; Transit peptide.,
O15164,Gene Ontology,TIF1A_HUMAN,Transcription intermediary factor 1-alpha,1050,3D-structure; Alternative splicing; Bromodomain; Chromosomal rearrangement;Coiled coil; Cytoplasm; Direct protein sequencing; DNA-binding;Isopeptide bond; Metal-binding; Methylation; Mitochondrion; Nucleus;Phosphoprotein; Reference proteome; Repeat; Repressor; Transcription;Transcription regulation; Transferase; Tumor suppressor; Ubl conjugation;Ubl conjugation pathway; Zinc; Zinc-finger.,Histone PTM readers;Euchromatin-associated;DNA-templated transcription
Q15291,Gene Ontology,RBBP5_HUMAN,Retinoblastoma-binding protein 5,538,3D-structure; Alternative splicing; Chromatin regulator; Isopeptide bond;Nucleus; Phosphoprotein; Reference proteome; Repeat; Transcription;Transcription regulation; Ubl conjugation; WD repeat.,DNA-templated transcription
Q16665,Gene Ontology,HIF1A_HUMAN,Hypoxia-inducible factor 1-alpha {ECO:0000305},826,3D-structure; Acetylation; Activator; Alternative splicing; Cytoplasm;Direct protein sequencing; DNA-binding; Glycoprotein;Host-virus interaction; Hydroxylation; Isopeptide bond; Nucleus;Phosphoprotein; Reference proteome; Repeat; S-nitrosylation; Transcription;Transcription regulation; Ubl conjugation.,Euchromatin-associated;Regulation of transcription;DNA-binding transcription factors
O43813,Gene Ontology,LANC1_HUMAN,Glutathione S-transferase LANCL1 {ECO:0000250|UniProtKB:O89112},399,3D-structure; Acetylation; Cell membrane; Cytoplasm;Direct protein sequencing; Membrane; Metal-binding; Reference proteome;Transferase; Zinc.,
Q9BU19,Gene Ontology,ZN692_HUMAN,Zinc finger protein 692 {ECO:0000305},519,3D-structure; Alternative splicing; DNA-binding; Metal-binding; Nucleus;Phosphoprotein; Reference proteome; Repeat; Transcription;Transcription regulation; Zinc; Zinc-finger.,DNA-binding transcription factors
Q16512,Gene Ontology,PKN1_HUMAN,Serine/threonine-protein kinase N1,942,3D-structure; Acetylation; Alternative splicing; ATP-binding;Cell membrane; Chromatin regulator; Coiled coil; Cytoplasm; Endosome;Kinase; Membrane; Nucleotide-binding; Nucleus; Phosphoprotein;Reference proteome; Repeat; Serine/threonine-protein kinase; Transcription;Transcription regulation; Transferase; Ubl conjugation.,Histone modification;Histone PTM writers
Q5JRX3,Gene Ontology,PREP_HUMAN,"Presequence protease, mitochondrial {ECO:0000305|PubMed:16849325}",1037,3D-structure; Acetylation; Alternative splicing; Disease variant;Disulfide bond; Hydrolase; Metal-binding; Metalloprotease; Mitochondrion;Neurodegeneration; Protease; Reference proteome; Transit peptide; Zinc.,
P62805,BioGRID,H4_HUMAN,Histone H4,103,3D-structure; Acetylation; Chromosomal rearrangement; Chromosome;Citrullination; Direct protein sequencing; Disease variant; DNA-binding;Hydroxylation; Intellectual disability; Isopeptide bond; Methylation;Nucleosome core; Nucleus; Phosphoprotein; Reference proteome;Ubl conjugation.,Histones
P14859,Gene Ontology,PO2F1_HUMAN,"POU domain, class 2, transcription factor 1",743,3D-structure; Activator; Alternative splicing; DNA-binding; Homeobox;Nucleus; Phosphoprotein; Reference proteome; Transcription;Transcription regulation.,Regulation of transcription;DNA-binding transcription factors
A5YKK6,Gene Ontology,CNOT1_HUMAN,CCR4-NOT transcription complex subunit 1,2376,3D-structure; Alternative splicing; Autism spectrum disorder; Cytoplasm;Developmental protein; Disease variant; Holoprosencephaly;Intellectual disability; Nucleus; Phosphoprotein; Reference proteome;Repressor; RNA-mediated gene silencing; Transcription;Transcription regulation; Translation regulation.,
Q13107,BioGRID,UBP4_HUMAN,Ubiquitin carboxyl-terminal hydrolase 4,963,3D-structure; Alternative splicing; Cytoplasm; Hydrolase; Metal-binding;Nucleus; Phosphoprotein; Protease; Proto-oncogene; Reference proteome;Repeat; Thiol protease; Ubl conjugation; Ubl conjugation pathway; Zinc.,
O15198,Gene Ontology,SMAD9_HUMAN,Mothers against decapentaplegic homolog 9,467,3D-structure; Alternative splicing; Cytoplasm; Disease variant;DNA-binding; Metal-binding; Nucleus; Phosphoprotein; Reference proteome;Transcription; Transcription regulation; Zinc.,Regulation of transcription;DNA-binding transcription factors
P45452,Gene Ontology,MMP13_HUMAN,Collagenase 3,471,3D-structure; Calcium; Collagen degradation; Direct protein sequencing;Disease variant; Disulfide bond; Dwarfism; Extracellular matrix;Glycoprotein; Hydrolase; Metal-binding; Metalloprotease; Phosphoprotein;Protease; Reference proteome; Repeat; Secreted; Signal; Zinc; Zymogen.,
P47224,Gene Ontology,MSS4_HUMAN,Guanine nucleotide exchange factor MSS4,123,3D-structure; Acetylation; Guanine-nucleotide releasing factor;Metal-binding; Protein transport; Reference proteome; Transport; Zinc.,
Q15672,Gene Ontology,TWST1_HUMAN,Twist-related protein 1,202,3D-structure; Activator; Biological rhythms; Craniosynostosis;Developmental protein; Differentiation; Disease variant; DNA-binding;Myogenesis; Nucleus; Reference proteome; Repressor; Transcription;Transcription regulation.,DNA-binding transcription factors
Q6ZMT4,Gene Ontology,KDM7A_HUMAN,Lysine-specific demethylase 7A,941,3D-structure; Alternative splicing; Chromatin regulator; Dioxygenase; Iron;Metal-binding; Neurogenesis; Nucleus; Oxidoreductase; Phosphoprotein;Reference proteome; Transcription; Transcription regulation; Zinc;Zinc-finger.,Histone PTM readers;Histone modification;Histone PTM erasers
O95391,Gene Ontology,SLU7_HUMAN,Pre-mRNA-splicing factor SLU7,586,3D-structure; Acetylation; Cytoplasm; Isopeptide bond; Metal-binding;mRNA processing; mRNA splicing; Nucleus; Phosphoprotein;Reference proteome; Spliceosome; Ubl conjugation; Zinc; Zinc-finger.,
P39019,BioGRID,RS19_HUMAN,Small ribosomal subunit protein eS19 {ECO:0000303|PubMed:24524803},145,3D-structure; Acetylation; Cytoplasm; Diamond-Blackfan anemia;Direct protein sequencing; Disease variant; Host-virus interaction;Methylation; Nucleus; Reference proteome; Ribonucleoprotein;Ribosomal protein.,Preribosome-associated
Q8IXQ6,Gene Ontology,PARP9_HUMAN,Protein mono-ADP-ribosyltransferase PARP9 {ECO:0000305},854,3D-structure; ADP-ribosylation; Alternative splicing; Antiviral defense;Cytoplasm; DNA damage; DNA repair; Glycosyltransferase; Immunity;Innate immunity; NAD; Nucleotidyltransferase; Nucleus; Reference proteome;Repeat; Transferase.,DNA repair
Q92974,Gene Ontology,ARHG2_HUMAN,Rho guanine nucleotide exchange factor 2,986,3D-structure; Acetylation; Alternative splicing; Cell cycle; Cell division;Cell junction; Cell membrane; Cell projection; Coiled coil; Cytoplasm;Cytoplasmic vesicle; Cytoskeleton; Developmental protein; Differentiation;Golgi apparatus; Guanine-nucleotide releasing factor; Immunity;Innate immunity; Intellectual disability; Membrane; Metal-binding;Microtubule; Mitosis; Neurogenesis; Phosphoprotein; Reference proteome;Tight junction; Zinc; Zinc-finger.,
P52945,Gene Ontology,PDX1_HUMAN,Pancreas/duodenum homeobox protein 1,283,3D-structure; Activator; Cytoplasm; Developmental protein;Diabetes mellitus; Disease variant; DNA-binding; Homeobox; Nucleus;Phosphoprotein; Reference proteome; Transcription;Transcription regulation.,DNA-binding transcription factors;DNA-templated transcription
P27708,Gene Ontology,PYR1_HUMAN,Dihydroorotase,2225,3D-structure; Acetylation; Allosteric enzyme; ATP-binding;Congenital disorder of glycosylation; Cytoplasm; Direct protein sequencing;Disease variant; Epilepsy; Hydrolase; Ligase; Magnesium; Manganese;Metal-binding; Multifunctional enzyme; Nucleotide-binding; Nucleus;Phosphoprotein; Pyrimidine biosynthesis; Reference proteome; Repeat;Transferase; Zinc.,
Q8NFU3,Gene Ontology,TSTD1_HUMAN,Thiosulfate:glutathione sulfurtransferase {ECO:0000303|PubMed:24981631},115,3D-structure; Alternative splicing; Cytoplasm; Direct protein sequencing;Reference proteome; Transferase.,DNA-binding transcription factors
O00308,Gene Ontology,WWP2_HUMAN,NEDD4-like E3 ubiquitin-protein ligase WWP2,870,3D-structure; Alternative splicing; Host-virus interaction; Nucleus;Phosphoprotein; Reference proteome; Repeat; Transferase; Ubl conjugation;Ubl conjugation pathway.,DNA-templated transcription
P49356,Gene Ontology,FNTB_HUMAN,Protein farnesyltransferase subunit beta,437,3D-structure; Alternative splicing; Lipid metabolism; Metal-binding;Phosphoprotein; Prenyltransferase; Reference proteome; Repeat; Transferase;Zinc.,
O15178,Gene Ontology,TBXT_HUMAN,T-box transcription factor T {ECO:0000305},435,3D-structure; Activator; Alternative splicing; Developmental protein;Disease variant; DNA-binding; Nucleus; Reference proteome; Transcription;Transcription regulation.,DNA-binding transcription factors
Q8NEG5,Gene Ontology,ZSWM2_HUMAN,E3 ubiquitin-protein ligase ZSWIM2,633,3D-structure; Apoptosis; Metal-binding; Reference proteome; Repeat;Transferase; Ubl conjugation; Ubl conjugation pathway; Zinc; Zinc-finger.,
Q02790,Gene Ontology,FKBP4_HUMAN,"Peptidyl-prolyl cis-trans isomerase FKBP4, N-terminally processed",459,3D-structure; Acetylation; Cell projection; Chaperone; Cytoplasm;Cytoskeleton; Direct protein sequencing; Isomerase; Isopeptide bond;Methylation; Microtubule; Mitochondrion; Nucleus; Phosphoprotein;Reference proteome; Repeat; Rotamase; TPR repeat; Ubl conjugation.,
Q13501,Gene Ontology,SQSTM_HUMAN,Sequestosome-1 {ECO:0000305},440,3D-structure; Acetylation; Alternative splicing;Amyotrophic lateral sclerosis; Apoptosis; Autophagy; Cytoplasm;Cytoplasmic vesicle; Differentiation; Direct protein sequencing;Disease variant; Endoplasmic reticulum; Endosome; Immunity;Isopeptide bond; Lipoprotein; Lysosome; Metal-binding; Neurodegeneration;Nucleus; Palmitate; Phosphoprotein; Reference proteome; Ubl conjugation;Zinc; Zinc-finger.,DNA-templated transcription
Q96JB3,Gene Ontology,HIC2_HUMAN,Hypermethylated in cancer 2 protein,615,3D-structure; Alternative splicing; DNA-binding; Metal-binding; Nucleus;Phosphoprotein; Reference proteome; Repeat; Repressor; Transcription;Transcription regulation; Zinc; Zinc-finger.,DNA-binding transcription factors
Q9P0M6,Gene Ontology,H2AW_HUMAN,Core histone macro-H2A.2,372,3D-structure; Chromatin regulator; Chromosome; DNA-binding;Isopeptide bond; Nucleosome core; Nucleus; Reference proteome;Ubl conjugation.,Histones
P55786,Gene Ontology,PSA_HUMAN,Puromycin-sensitive aminopeptidase,919,3D-structure; Alternative splicing; Aminopeptidase; Cytoplasm;Direct protein sequencing; Hydrolase; Metal-binding; Metalloprotease;Nitration; Nucleus; Protease; Reference proteome; Zinc.,
Q9H4P4,Gene Ontology,RNF41_HUMAN,E3 ubiquitin-protein ligase NRDP1,317,3D-structure; Alternative splicing; Apoptosis; Autophagy; Metal-binding;Reference proteome; Transferase; Ubl conjugation; Ubl conjugation pathway;Zinc; Zinc-finger.,
O14770,Gene Ontology,MEIS2_HUMAN,Homeobox protein Meis2,477,3D-structure; Activator; Alternative splicing; Cytoplasm;Developmental protein; Disease variant; DNA-binding; Homeobox;Intellectual disability; Nucleus; Reference proteome; Transcription;Transcription regulation.,DNA-binding transcription factors
Q9HBE1,Gene Ontology,PATZ1_HUMAN,"POZ-, AT hook-, and zinc finger-containing protein 1",687,3D-structure; Alternative splicing; Chromosomal rearrangement; DNA-binding;Isopeptide bond; Metal-binding; Nucleus; Phosphoprotein; Proto-oncogene;Reference proteome; Repeat; Repressor; Transcription;Transcription regulation; Ubl conjugation; Zinc; Zinc-finger.,DNA-binding transcription factors
Q9Y2Y4,Gene Ontology,ZBT32_HUMAN,Zinc finger and BTB domain-containing protein 32,487,3D-structure; DNA-binding; Metal-binding; Nucleus; Reference proteome;Repeat; Repressor; Transcription; Transcription regulation; Zinc;Zinc-finger.,DNA-binding transcription factors
Q13285,Gene Ontology,STF1_HUMAN,Steroidogenic factor 1,461,3D-structure; Acetylation; Activator; Disease variant; DNA-binding;Isopeptide bond; Lipid-binding; Metal-binding; Nucleus; Phosphoprotein;Premature ovarian failure; Receptor; Reference proteome; Transcription;Transcription regulation; Ubl conjugation; Zinc; Zinc-finger.,Nuclear hormone receptors;Regulation of transcription;DNA-binding transcription factors
P11831,Gene Ontology,SRF_HUMAN,Serum response factor,508,3D-structure; Activator; Developmental protein; Direct protein sequencing;DNA-binding; Glycoprotein; Nucleus; Phosphoprotein; Reference proteome;Transcription; Transcription regulation.,DNA-binding transcription factors;DNA-templated transcription
P31271,Gene Ontology,HXA13_HUMAN,Homeobox protein Hox-A13,388,3D-structure; Developmental protein; Disease variant; DNA-binding;Homeobox; Nucleus; Reference proteome; Transcription;Transcription regulation.,DNA-binding transcription factors;DNA-templated transcription
Q13510,Gene Ontology,ASAH1_HUMAN,Acid ceramidase subunit beta {ECO:0000303|PubMed:7744740},395,3D-structure; Alternative splicing; Cytoplasm; Direct protein sequencing;Disease variant; Disulfide bond; Epilepsy; Glycoprotein; Hydrolase;Lipid metabolism; Lysosome; Neurodegeneration; Nucleus; Reference proteome;Secreted; Signal; Sphingolipid metabolism.,
P07902,Gene Ontology,GALT_HUMAN,Galactose-1-phosphate uridylyltransferase,379,3D-structure; Alternative splicing; Carbohydrate metabolism; Cataract;Disease variant; Galactose metabolism; Metal-binding;Nucleotidyltransferase; Reference proteome; Transferase; Zinc.,
P17844,Gene Ontology,DDX5_HUMAN,Probable ATP-dependent RNA helicase DDX5,614,3D-structure; Acetylation; Alternative splicing; ATP-binding;Biological rhythms; Cytoplasm; Helicase; Hydrolase; Isopeptide bond;mRNA processing; mRNA splicing; Nucleotide-binding; Nucleus;Phosphoprotein; Reference proteome; RNA-binding; Spliceosome;Transcription; Transcription regulation; Ubl conjugation.,RNA processing;DNA-templated transcription
Q86VX2,Gene Ontology,COMD7_HUMAN,COMM domain-containing protein 7,200,3D-structure; Alternative splicing; Cytoplasmic vesicle;Reference proteome; Transcription; Transcription regulation;Ubl conjugation pathway.,
Q9NPI1,Gene Ontology,BRD7_HUMAN,Bromodomain-containing protein 7,651,3D-structure; Acetylation; Alternative splicing; Bromodomain; Cell cycle;Chromosome; Coiled coil; Isopeptide bond; Nucleus; Phosphoprotein;Reference proteome; Transcription; Transcription regulation;Tumor suppressor; Ubl conjugation; Wnt signaling pathway.,Histone PTM readers;Chromatin remodelers;Centromere-associated;DNA-templated transcription
Q6NT76,Gene Ontology,HMBX1_HUMAN,Homeobox-containing protein 1 {ECO:0000303|PubMed:16825764},420,3D-structure; Alternative splicing; Chromosome; Cytoplasm; DNA-binding;Homeobox; Isopeptide bond; Nucleus; Phosphoprotein; Reference proteome;Telomere; Transcription; Transcription regulation; Ubl conjugation.,Telomere-associated
Q9NQ86,Gene Ontology,TRI36_HUMAN,E3 ubiquitin-protein ligase TRIM36,728,3D-structure; Alternative splicing; Coiled coil; Cytoplasm;Cytoplasmic vesicle; Cytoskeleton; Disease variant; Metal-binding;Reference proteome; Repeat; Transferase; Ubl conjugation pathway; Zinc;Zinc-finger.,
Q12809,Gene Ontology,KCNH2_HUMAN,Potassium voltage-gated channel subfamily H member 2,1159,3D-structure; Alternative splicing; Cell membrane; Deafness;Disease variant; Glycoprotein; Ion channel; Ion transport;Long QT syndrome; Membrane; Methylation; Phosphoprotein; Potassium;Potassium channel; Potassium transport; Reference proteome;Short QT syndrome; Transmembrane; Transmembrane helix; Transport;Voltage-gated channel.,
Q9NZI8,BioGRID,IF2B1_HUMAN,Insulin-like growth factor 2 mRNA-binding protein 1,577,3D-structure; Alternative splicing; Cell projection; Cytoplasm;Direct protein sequencing; mRNA transport; Nucleus; Phosphoprotein;Reference proteome; Repeat; RNA-binding; Synapse; Translation regulation;Transport.,
Q2Q1W2,Gene Ontology,LIN41_HUMAN,E3 ubiquitin-protein ligase TRIM71 {ECO:0000305},868,3D-structure; Acetylation; Coiled coil; Cytoplasm; Developmental protein;Disease variant; Metal-binding; Reference proteome; Repeat; RNA-binding;RNA-mediated gene silencing; Transferase; Ubl conjugation;Ubl conjugation pathway; Zinc; Zinc-finger.,
P62241,BioGRID,RS8_HUMAN,Small ribosomal subunit protein eS8 {ECO:0000303|PubMed:24524803},208,3D-structure; Acetylation; Cytoplasm; Direct protein sequencing;Isopeptide bond; Lipoprotein; Membrane; Myristate; Nucleus; Phosphoprotein;Reference proteome; Ribonucleoprotein; Ribosomal protein; Ubl conjugation.,Preribosome-associated
Q8TCF1,Gene Ontology,ZFAN1_HUMAN,AN1-type zinc finger protein 1 {ECO:0000305},268,3D-structure; Alternative splicing; Cytoplasm; Metal-binding;Reference proteome; Repeat; Zinc; Zinc-finger.,
P20393,Gene Ontology,NR1D1_HUMAN,Nuclear receptor subfamily 1 group D member 1,614,3D-structure; Acetylation; Activator; Biological rhythms; Cell projection;Cytoplasm; Differentiation; DNA-binding; Heme; Iron; Metal-binding;Nucleus; Phosphoprotein; Receptor; Reference proteome; Repressor; Synapse;Transcription; Transcription regulation; Ubl conjugation; Zinc;Zinc-finger.,Nuclear hormone receptors;DNA-binding transcription factors
O00409,Gene Ontology,FOXN3_HUMAN,Forkhead box protein N3,490,3D-structure; Alternative splicing; Cell cycle; DNA-binding; Nucleus;Phosphoprotein; Reference proteome; Repressor; Transcription;Transcription regulation.,DNA-binding transcription factors
Q9H2H0,Gene Ontology,CXXC4_HUMAN,CXXC-type zinc finger protein 4,198,3D-structure; Cytoplasm; DNA-binding; Metal-binding; Reference proteome;Wnt signaling pathway; Zinc; Zinc-finger.,Methylated DNA binding
P17861,Gene Ontology,XBP1_HUMAN,"X-box-binding protein 1, luminal form {ECO:0000303|PubMed:25239945}",261,3D-structure; Acetylation; Activator; Alternative splicing; Angiogenesis;Apoptosis; Autophagy; Cleavage on pair of basic residues; Cytoplasm;Developmental protein; Differentiation; DNA-binding; Endoplasmic reticulum;Lipid biosynthesis; Lipid metabolism; Membrane; Myogenesis; Nucleus;Oncogene; Phosphoprotein; Protein transport; Reference proteome;Signal-anchor; Stress response; Transcription; Transcription regulation;Transmembrane; Transmembrane helix; Transport; Ubl conjugation;Unfolded protein response.,Regulation of transcription;DNA-binding transcription factors;DNA-templated transcription
Q6HA08,Gene Ontology,ASTL_HUMAN,Astacin-like metalloendopeptidase,431,3D-structure; Cell membrane; Cytoplasm; Cytoplasmic vesicle;Disulfide bond; Fertilization; Hydrolase; Membrane; Metal-binding;Metalloprotease; Protease; Reference proteome; Signal; Zinc; Zymogen.,
O00482,Gene Ontology,NR5A2_HUMAN,Nuclear receptor subfamily 5 group A member 2,541,3D-structure; Activator; Alternative splicing; DNA-binding;Isopeptide bond; Lipid-binding; Metal-binding; Nucleus; Receptor;Reference proteome; Transcription; Transcription regulation;Ubl conjugation; Zinc; Zinc-finger.,Nuclear hormone receptors;Regulation of transcription;DNA-binding transcription factors
Q09028,Gene Ontology,RBBP4_HUMAN,Histone-binding protein RBBP4,425,3D-structure; Acetylation; Alternative splicing; Cell cycle;Chromatin regulator; Chromosome; Direct protein sequencing;DNA replication; Isopeptide bond; Nucleus; Phosphoprotein;Reference proteome; Repeat; Repressor; Telomere; Transcription;Transcription regulation; Ubl conjugation; WD repeat.,Chromatin remodelers;DNA replication;Telomere-associated;DNA-modifying enzymes;Histone chaperones
P35221,Gene Ontology,CTNA1_HUMAN,Catenin alpha-1,906,3D-structure; Acetylation; Alternative splicing; Cell adhesion;Cell junction; Cell membrane; Cytoplasm; Cytoskeleton;Direct protein sequencing; Isopeptide bond; Membrane; Phosphoprotein;Reference proteome; Ubl conjugation.,
Q15649,Gene Ontology,ZNHI3_HUMAN,Zinc finger HIT domain-containing protein 3,155,3D-structure; Alternative splicing; Cytoplasm; Disease variant; Epilepsy;Intellectual disability; Metal-binding; Neurodegeneration; Nucleus;Phosphoprotein; Reference proteome; Zinc; Zinc-finger.,
P49916,Gene Ontology,DNLI3_HUMAN,DNA ligase 3,1009,3D-structure; Alternative initiation; Alternative splicing; ATP-binding;Cell cycle; Cell division; Disease variant; DNA damage; DNA recombination;DNA repair; DNA replication; Ligase; Magnesium; Metal-binding;Mitochondrion; Nucleotide-binding; Nucleus; Phosphoprotein;Primary mitochondrial disease; Reference proteome; Transit peptide; Zinc;Zinc-finger.,DNA replication;DNA repair;DNA-modifying enzymes
