UniProt AC,Database,Gene ID,Record Name,Amino Acids,Keywords,SimChrom
P15144,Gene Ontology,AMPN_HUMAN,Aminopeptidase N {ECO:0000305},967,3D-structure; Aminopeptidase; Angiogenesis; Cell membrane;Developmental protein; Differentiation; Direct protein sequencing;Disulfide bond; Glycoprotein; Host cell receptor for virus entry;Host-virus interaction; Hydrolase; Membrane; Metal-binding;Metalloprotease; Protease; Receptor; Reference proteome; Signal-anchor;Sulfation; Transmembrane; Transmembrane helix; Zinc.,
Q8IWV8,Gene Ontology,UBR2_HUMAN,E3 ubiquitin-protein ligase UBR2,1755,3D-structure; Acetylation; Alternative splicing; Chromosome; Coiled coil;Metal-binding; Nucleus; Reference proteome; Transferase;Ubl conjugation pathway; Zinc; Zinc-finger.,Histone modification;Histone PTM writers;DNA recombination
P31274,Gene Ontology,HXC9_HUMAN,Homeobox protein Hox-C9,260,3D-structure; Developmental protein; DNA-binding; Homeobox; Nucleus;Phosphoprotein; Reference proteome; Transcription;Transcription regulation.,DNA-binding transcription factors
Q9BUJ2,BioGRID,HNRL1_HUMAN,Heterogeneous nuclear ribonucleoprotein U-like protein 1,856,Activator; Alternative splicing; Isopeptide bond; Methylation; Nucleus;Phosphoprotein; Reference proteome; Repeat; Repressor; Ribonucleoprotein;RNA-binding; Transcription; Transcription regulation; Ubl conjugation.,
P32321,Gene Ontology,DCTD_HUMAN,Deoxycytidylate deaminase {ECO:0000305|PubMed:7685356},178,3D-structure; Allosteric enzyme; Alternative splicing;Direct protein sequencing; Hydrolase; Metal-binding;Nucleotide biosynthesis; Phosphoprotein; Reference proteome; Zinc.,
O94916,Gene Ontology,NFAT5_HUMAN,Nuclear factor of activated T-cells 5,1531,3D-structure; Acetylation; Activator; ADP-ribosylation;Alternative splicing; Chromosome; Cytoplasm; DNA damage; DNA-binding;Isopeptide bond; Nucleus; Phosphoprotein; Reference proteome;Transcription; Transcription regulation; Ubl conjugation.,DNA-binding transcription factors;DNA-templated transcription
P23025,Gene Ontology,XPA_HUMAN,DNA repair protein complementing XP-A cells,273,3D-structure; Acetylation; Disease variant; DNA damage; DNA repair;DNA-binding; Isopeptide bond; Metal-binding; Nucleus; Phosphoprotein;Reference proteome; Ubl conjugation; Xeroderma pigmentosum; Zinc;Zinc-finger.,DNA repair
P23511,Gene Ontology,NFYA_HUMAN,Nuclear transcription factor Y subunit alpha,347,3D-structure; Activator; Alternative splicing; Biological rhythms;DNA-binding; Nucleus; Phosphoprotein; Reference proteome; Transcription;Transcription regulation.,Regulation of transcription;DNA-binding transcription factors;DNA-templated transcription
Q16820,Gene Ontology,MEP1B_HUMAN,Meprin A subunit beta,701,3D-structure; Cell membrane; Direct protein sequencing; Disulfide bond;EGF-like domain; Glycoprotein; Hydrolase; Inflammatory response; Membrane;Metal-binding; Metalloprotease; Protease; Reference proteome; Secreted;Signal; Transmembrane; Transmembrane helix; Zinc; Zymogen.,
Q92966,Gene Ontology,SNPC3_HUMAN,snRNA-activating protein complex subunit 3,411,3D-structure; DNA-binding; Nucleus; Reference proteome; Transcription;Transcription regulation.,DNA-templated transcription
Q96BT7,Gene Ontology,ALKB8_HUMAN,Alkylated DNA repair protein alkB homolog 8,664,3D-structure; Alternative splicing; Cytoplasm; Disease variant;Intellectual disability; Iron; Metal-binding; Methyltransferase;Multifunctional enzyme; Nucleus; Reference proteome; RNA-binding;S-adenosyl-L-methionine; Transferase; Zinc.,
Q9Y3I1,BioGRID,FBX7_HUMAN,F-box only protein 7,522,3D-structure; Alternative splicing; Cytoplasm; Disease variant;Methylation; Mitochondrion; Neurodegeneration; Nucleus; Parkinson disease;Parkinsonism; Reference proteome; Ubl conjugation pathway.,
P06733,Gene Ontology,ENOA_HUMAN,Alpha-enolase,434,3D-structure; Acetylation; Alternative initiation; Cell membrane;Cytoplasm; Direct protein sequencing; DNA-binding; Glycolysis;Hydroxylation; Isopeptide bond; Lyase; Magnesium; Membrane; Metal-binding;Nucleus; Phosphoprotein; Plasminogen activation; Reference proteome;Repressor; Transcription; Transcription regulation; Ubl conjugation.,DNA-binding transcription factors
Q8NB78,Gene Ontology,TTTDGTGYSA,Lysine-specific histone demethylase 2 {ECO:0000305},PPLSEKKMKA,3D-structure; Alternative splicing; Chromatin regulator; Chromosome;Developmental protein; FAD; Flavoprotein; Metal-binding; Nucleus;Oxidoreductase; Phosphoprotein; Reference proteome; Repressor;Transcription; Transcription regulation; Zinc; Zinc-finger.,Histone modification;Histone PTM erasers
Q8NI08,Gene Ontology,NCOA7_HUMAN,Nuclear receptor coactivator 7,942,3D-structure; Acetylation; Activator; Alternative splicing; Coiled coil;Nucleus; Phosphoprotein; Reference proteome; Transcription;Transcription regulation.,
Q9H4W6,Gene Ontology,COE3_HUMAN,Transcription factor COE3,596,3D-structure; Activator; Alternative splicing; Developmental protein;Disease variant; DNA-binding; Intellectual disability; Metal-binding;Nucleus; Reference proteome; Transcription; Transcription regulation; Zinc;Zinc-finger.,DNA-binding transcription factors
P14735,Gene Ontology,IDE_HUMAN,Insulin-degrading enzyme {ECO:0000303|PubMed:20364150},1019,3D-structure; Allosteric enzyme; Alternative splicing; ATP-binding;Cell membrane; Cytoplasm; Direct protein sequencing;Host cell receptor for virus entry; Host-virus interaction; Hydrolase;Membrane; Metal-binding; Metalloprotease; Nucleotide-binding; Protease;Receptor; Reference proteome; Secreted; Zinc.,
Q9NUN7,Gene Ontology,ACER3_HUMAN,Alkaline ceramidase 3,267,3D-structure; Alternative splicing; Calcium; Disease variant;Endoplasmic reticulum; Golgi apparatus; Hydrolase; Leukodystrophy;Lipid metabolism; Membrane; Metal-binding; Reference proteome;Sphingolipid metabolism; Transmembrane; Transmembrane helix; Zinc.,
Q5JTZ9,Gene Ontology,SYAM_HUMAN,"Alanine--tRNA ligase, mitochondrial {ECO:0000255|HAMAP-Rule:MF_03133}",985,3D-structure; Aminoacyl-tRNA synthetase; ATP-binding; Cardiomyopathy;Disease variant; Ligase; Metal-binding; Mitochondrion; Neurodegeneration;Nucleotide-binding; Premature ovarian failure;Primary mitochondrial disease; Protein biosynthesis; Reference proteome;RNA-binding; Transit peptide; tRNA-binding; Zinc.,
O75362,Gene Ontology,ZN217_HUMAN,Zinc finger protein 217,1048,3D-structure; DNA-binding; Isopeptide bond; Metal-binding; Nucleus;Phosphoprotein; Reference proteome; Repeat; Repressor; Transcription;Transcription regulation; Ubl conjugation; Zinc; Zinc-finger.,DNA-binding transcription factors
P00915,Gene Ontology,CAH1_HUMAN,Carbonic anhydrase 1,261,3D-structure; Acetylation; Cytoplasm; Direct protein sequencing; Lyase;Metal-binding; Reference proteome; Zinc.,
Q9NRW3,Gene Ontology,ABC3C_HUMAN,DNA dC->dU-editing enzyme APOBEC-3C,190,3D-structure; Antiviral defense; Cytoplasm; Host-virus interaction;Hydrolase; Immunity; Innate immunity; Metal-binding; Nucleus;Reference proteome; Zinc.,DNA-templated transcription
Q6B0I6,Gene Ontology,SCGEARVTFS,Lysine-specific demethylase 4D,DRAVVDHMEP,3D-structure; ADP-ribosylation; Chromatin regulator; Dioxygenase; Iron;Metal-binding; Nucleus; Oxidoreductase; Reference proteome; Transcription;Transcription regulation; Ubl conjugation; Zinc.,Histone modification;Histone PTM erasers;DNA repair;Centromere-associated;Heterochromatin-associated
P35222,STRING,CTNB1_HUMAN,Catenin beta-1 {ECO:0000312|HGNC:HGNC:2514},781,3D-structure; Acetylation; Activator; Cell adhesion; Cell junction;Cell membrane; Cell projection; Chromosomal rearrangement; Cytoplasm;Cytoskeleton; Disease variant; Glycoprotein; Host-virus interaction;Intellectual disability; Membrane; Neurogenesis; Nucleus; Phosphoprotein;Reference proteome; Repeat; S-nitrosylation; Synapse; Transcription;Transcription regulation; Ubl conjugation; Wnt signaling pathway.,Euchromatin-associated;Regulation of transcription;DNA-templated transcription
Q00653,Gene Ontology,NFKB2_HUMAN,Nuclear factor NF-kappa-B p52 subunit,900,3D-structure; Activator; Alternative splicing; ANK repeat;Biological rhythms; Chromosomal rearrangement; Cytoplasm;Direct protein sequencing; Disease variant; DNA-binding; Isopeptide bond;Nucleus; Phosphoprotein; Proto-oncogene; Reference proteome; Repeat;Repressor; Transcription; Transcription regulation; Ubl conjugation.,DNA-binding transcription factors
P20700,Gene Ontology,LMNB1_HUMAN,Lamin-B1,586,3D-structure; Acetylation; Chromosomal rearrangement; Coiled coil;Direct protein sequencing; Disease variant; Disulfide bond; Glycoprotein;Intellectual disability; Intermediate filament; Isopeptide bond;Leukodystrophy; Lipoprotein; Methylation; Nucleus; Phosphoprotein;Prenylation; Primary microcephaly; Reference proteome; Ubl conjugation.,
P16083,Gene Ontology,NQO2_HUMAN,Ribosyldihydronicotinamide dehydrogenase [quinone],231,3D-structure; Cytoplasm; FAD; Flavoprotein; Metal-binding; Oxidoreductase;Phosphoprotein; Reference proteome; Zinc.,
P15941,Gene Ontology,MUC1_HUMAN,Mucin-1 subunit beta,1255,3D-structure; Alternative splicing; Autocatalytic cleavage; Cell membrane;Cytoplasm; Direct protein sequencing; Disulfide bond; Glycoprotein;Lipoprotein; Membrane; Nucleus; Palmitate; Phosphoprotein;Reference proteome; Repeat; Secreted; Signal; Transmembrane;Transmembrane helix; Tumor suppressor.,
Q96FI4,Gene Ontology,NEIL1_HUMAN,Endonuclease 8-like 1,390,3D-structure; Chromosome; Cytoplasm; Cytoskeleton; DNA damage; DNA repair;DNA-binding; Glycosidase; Hydrolase; Lyase; Multifunctional enzyme;Nucleus; Reference proteome; RNA editing.,DNA repair;DNA-modifying enzymes
Q9BTP6,Gene Ontology,ZBED2_HUMAN,Zinc finger BED domain-containing protein 2,218,3D-structure; DNA-binding; Metal-binding; Nucleus; Reference proteome;Repressor; Transcription; Transcription regulation; Zinc; Zinc-finger.,DNA-binding transcription factors
Q9NZ08,Gene Ontology,ERAP1_HUMAN,Endoplasmic reticulum aminopeptidase 1,941,3D-structure; Adaptive immunity; Alternative splicing; Aminopeptidase;Direct protein sequencing; Disulfide bond; Endoplasmic reticulum;Glycoprotein; Hydrolase; Immunity; Membrane; Metal-binding;Metalloprotease; Protease; Reference proteome; Signal-anchor;Transmembrane; Transmembrane helix; Zinc.,
Q14134,Gene Ontology,TRI29_HUMAN,Tripartite motif-containing protein 29,588,3D-structure; Alternative splicing; Coiled coil; Cytoplasm; Immunity;Innate immunity; Lysosome; Metal-binding; Phosphoprotein;Reference proteome; Zinc; Zinc-finger.,
P63145,Gene Ontology,GAK24_HUMAN,Endogenous retrovirus group K member 24 Gag polyprotein,666,3D-structure; Cell membrane; ERV; Lipoprotein; Membrane; Metal-binding;Myristate; Reference proteome; Repeat; Ribosomal frameshifting;Transposable element; Zinc; Zinc-finger.,
P12956,Gene Ontology,XRCC6_HUMAN,X-ray repair cross-complementing protein 6,609,3D-structure; Acetylation; Activator; ADP-ribosylation;Alternative splicing; ATP-binding; Chromosome; Direct protein sequencing;DNA damage; DNA recombination; DNA repair; DNA-binding; Helicase;Host-virus interaction; Hydrolase; Immunity; Innate immunity;Isopeptide bond; Lyase; Multifunctional enzyme; Nucleotide-binding;Nucleus; Phosphoprotein; Reference proteome; Systemic lupus erythematosus;Transcription; Transcription regulation; Ubl conjugation.,DNA repair;Telomere-associated;DNA-modifying enzymes
Q9P0U4,Gene Ontology,CXXC1_HUMAN,CXXC-type zinc finger protein 1,656,3D-structure; Acetylation; Activator; Alternative splicing; Coiled coil;DNA-binding; Isopeptide bond; Metal-binding; Nucleus; Phosphoprotein;Reference proteome; Transcription; Transcription regulation;Ubl conjugation; Zinc; Zinc-finger.,Histone PTM readers
Q12874,Gene Ontology,SF3A3_HUMAN,Splicing factor 3A subunit 3,501,3D-structure; Acetylation; Direct protein sequencing; Metal-binding;mRNA processing; mRNA splicing; Nucleus; Phosphoprotein;Reference proteome; Spliceosome; Zinc; Zinc-finger.,RNA processing
P45974,Gene Ontology,UBP5_HUMAN,Ubiquitin carboxyl-terminal hydrolase 5,858,3D-structure; Acetylation; Alternative splicing; Direct protein sequencing;Disulfide bond; Hydrolase; Metal-binding; Phosphoprotein; Protease;Reference proteome; Repeat; Thiol protease; Ubl conjugation pathway; Zinc;Zinc-finger.,
O95786,Gene Ontology,RIGI_HUMAN,Antiviral innate immune response receptor RIG-I {ECO:0000305},925,3D-structure; Acetylation; Alternative splicing; Antiviral defense;ATP-binding; Cell junction; Cell membrane; Cell projection; Cytoplasm;Cytoskeleton; Disease variant; Helicase; Host-virus interaction; Hydrolase;Immunity; Innate immunity; Isopeptide bond; Membrane; Metal-binding;Nucleotide-binding; Phosphoprotein; Reference proteome; Repeat;RNA-binding; Tight junction; Ubl conjugation; Zinc.,
Q86Y01,Gene Ontology,DTX1_HUMAN,E3 ubiquitin-protein ligase DTX1,620,3D-structure; Cytoplasm; Metal-binding; Notch signaling pathway; Nucleus;Reference proteome; Repeat; SH3-binding; Transferase; Ubl conjugation;Zinc; Zinc-finger.,DNA-templated transcription
Q9BYB0,Gene Ontology,SHAN3_HUMAN,SH3 and multiple ankyrin repeat domains protein 3,1731,3D-structure; Actin-binding; Alternative promoter usage; ANK repeat;Autism spectrum disorder; Cell projection; Chromosomal rearrangement;Coiled coil; Cytoplasm; Disease variant; Methylation; Phosphoprotein;Reference proteome; Repeat; Schizophrenia; SH3 domain; SH3-binding;Synapse.,
Q8NHM5,Gene Ontology,KDM2B_HUMAN,Lysine-specific demethylase 2B,1336,3D-structure; Alternative splicing; Chromatin regulator; Chromosome;Coiled coil; Dioxygenase; DNA-binding; Iron; Isopeptide bond;Leucine-rich repeat; Metal-binding; Nucleus; Oxidoreductase;Phosphoprotein; Reference proteome; Repeat; Repressor; RNA-binding;rRNA-binding; Transcription; Transcription regulation; Ubl conjugation;Ubl conjugation pathway; Zinc; Zinc-finger.,Histone modification;Histone PTM erasers
Q9NZC2,Gene Ontology,TREM2_HUMAN,Triggering receptor expressed on myeloid cells 2,230,3D-structure; Alternative splicing; Cell membrane; Disease variant;Disulfide bond; Glycoprotein; Immunoglobulin domain; Lipid-binding;Membrane; Neurodegeneration; Receptor; Reference proteome; Secreted;Signal; Transmembrane; Transmembrane helix.,
P78310,Gene Ontology,CXAR_HUMAN,Coxsackievirus and adenovirus receptor,365,3D-structure; Alternative splicing; Cell adhesion; Cell junction;Cell membrane; Disulfide bond; Glycoprotein;Host cell receptor for virus entry; Host-virus interaction;Immunoglobulin domain; Lipoprotein; Membrane; Palmitate; Phosphoprotein;Receptor; Reference proteome; Repeat; Secreted; Signal; Tight junction;Transmembrane; Transmembrane helix.,
Q93009,BioGRID,UBP7_HUMAN,Ubiquitin carboxyl-terminal hydrolase 7,1102,3D-structure; Acetylation; Alternative splicing; Autism spectrum disorder;Biological rhythms; Chromosome; Cytoplasm; Developmental protein;Direct protein sequencing; Disease variant; DNA damage; DNA repair;Epilepsy; Host-virus interaction; Hydrolase; Intellectual disability;Isopeptide bond; Nucleus; Phosphoprotein; Protease; Reference proteome;Thiol protease; Ubl conjugation; Ubl conjugation pathway.,DNA repair
Q96KR1,BioGRID,ZFR_HUMAN,Zinc finger RNA-binding protein,1074,Acetylation; Chromosome; Cytoplasm; Developmental protein; DNA-binding;Isopeptide bond; Nucleus; Phosphoprotein; Reference proteome; Repeat;RNA-binding; Ubl conjugation.,
Q99536,Gene Ontology,VAT1_HUMAN,Synaptic vesicle membrane protein VAT-1 homolog,393,3D-structure; Acetylation; Alternative splicing; Cytoplasm;Direct protein sequencing; Membrane; Mitochondrion;Mitochondrion outer membrane; Oxidoreductase; Phosphoprotein;Reference proteome.,
Q8WWV3,Gene Ontology,RT4I1_HUMAN,"Reticulon-4-interacting protein 1, mitochondrial",396,3D-structure; Alternative splicing; Disease variant; Membrane;Mitochondrion; Mitochondrion outer membrane; Neurogenesis;Reference proteome; Transit peptide.,
Q00987,Gene Ontology,MDM2_HUMAN,E3 ubiquitin-protein ligase Mdm2,491,3D-structure; Alternative splicing; Apoptosis; Cytoplasm;Host-virus interaction; Metal-binding; Nucleus; Phosphoprotein;Proto-oncogene; Reference proteome; Transferase; Ubl conjugation;Ubl conjugation pathway; Zinc; Zinc-finger.,
Q15545,Gene Ontology,TAF7_HUMAN,Transcription initiation factor TFIID subunit 7,349,3D-structure; Coiled coil; Nucleus; Phosphoprotein; Reference proteome;Transcription; Transcription regulation; Ubl conjugation.,Histone PTM readers;Regulation of transcription;General TFs;DNA-templated transcription
P19793,Gene Ontology,RXRA_HUMAN,Retinoic acid receptor RXR-alpha,462,3D-structure; Acetylation; Alternative splicing; Cytoplasm; DNA-binding;Host-virus interaction; Isopeptide bond; Metal-binding; Mitochondrion;Nucleus; Phosphoprotein; Receptor; Reference proteome; Transcription;Transcription regulation; Ubl conjugation; Zinc; Zinc-finger.,Nuclear hormone receptors;Regulation of transcription;DNA-binding transcription factors;DNA-templated transcription
P04150,Gene Ontology,GCR_HUMAN,Glucocorticoid receptor,777,3D-structure; Acetylation; Alternative initiation; Alternative splicing;Apoptosis; Cell cycle; Cell division; Chromatin regulator;Chromosome partition; Cytoplasm; Cytoskeleton; Disease variant;DNA-binding; Isopeptide bond; Lipid-binding; Metal-binding; Methylation;Mitochondrion; Mitosis; Nucleus; Phosphoprotein; Pseudohermaphroditism;Receptor; Reference proteome; RNA-binding; Steroid-binding; Transcription;Transcription regulation; Ubl conjugation; Zinc; Zinc-finger.,Nuclear hormone receptors;DNA-binding transcription factors
Q9Y2Y1,Gene Ontology,RPC10_HUMAN,DNA-directed RNA polymerase III subunit RPC10,108,3D-structure; Antiviral defense; Disease variant;DNA-directed RNA polymerase; Immunity; Innate immunity; Leukodystrophy;Metal-binding; Neurodegeneration; Nucleus; Reference proteome;Transcription; Zinc; Zinc-finger.,RNA polymerases;DNA-templated transcription
P23246,Gene Ontology,SFPQ_HUMAN,"Splicing factor, proline- and glutamine-rich",707,3D-structure; Acetylation; Activator; Alternative splicing;Biological rhythms; Chromosomal rearrangement; Coiled coil; Cytoplasm;Direct protein sequencing; DNA damage; DNA recombination; DNA repair;DNA-binding; Immunity; Innate immunity; Isopeptide bond; Methylation;mRNA processing; mRNA splicing; Nucleus; Phosphoprotein;Reference proteome; Repeat; Repressor; RNA-binding; Transcription;Transcription regulation; Ubl conjugation.,DNA repair;RNA processing;Regulation of transcription
Q9H9Z2,STRING,LN28A_HUMAN,Protein lin-28 homolog A,209,3D-structure; Acetylation; Cytoplasm; Endoplasmic reticulum; Metal-binding;Nucleus; Phosphoprotein; Reference proteome; Repeat; RNA-binding;RNA-mediated gene silencing; Zinc; Zinc-finger.,
Q9NTG7,Gene Ontology,SIR3_HUMAN,"NAD-dependent protein deacetylase sirtuin-3, mitochondrial",399,3D-structure; Alternative splicing; Metal-binding; Mitochondrion; NAD;Reference proteome; Transferase; Transit peptide; Zinc.,Histone modification;Histone PTM erasers
P10827,Gene Ontology,THA_HUMAN,Thyroid hormone receptor alpha,490,3D-structure; Alternative splicing; Congenital hypothyroidism; Cytoplasm;Disease variant; DNA-binding; Metal-binding; Nucleus; Receptor;Reference proteome; Transcription; Transcription regulation; Zinc;Zinc-finger.,Nuclear hormone receptors;DNA-binding transcription factors;DNA-templated transcription
Q15022,Gene Ontology,SUZ12_HUMAN,Polycomb protein SUZ12,739,3D-structure; Chromatin regulator; Chromosomal rearrangement;Disease variant; Intellectual disability; Isopeptide bond; Metal-binding;Nucleus; Phosphoprotein; Proto-oncogene; Reference proteome; Repressor;Transcription; Transcription regulation; Ubl conjugation; Zinc;Zinc-finger.,Histone PTM readers;Histone modification;Chromatin remodelers;Heterochromatin-associated;X-chromosome inactivation
O15016,Gene Ontology,TRI66_HUMAN,Tripartite motif-containing protein 66,1351,3D-structure; Alternative splicing; Bromodomain; Coiled coil;Metal-binding; Nucleus; Reference proteome; Repeat; Zinc; Zinc-finger.,
Q86VK4,Gene Ontology,ZN410_HUMAN,Zinc finger protein 410 {ECO:0000305},478,3D-structure; Activator; Alternative splicing; Chromosome; DNA-binding;Glycoprotein; Metal-binding; Nucleus; Reference proteome; Repeat;Transcription; Transcription regulation; Ubl conjugation; Zinc;Zinc-finger.,DNA-binding transcription factors
Q15853,Gene Ontology,USF2_HUMAN,Upstream stimulatory factor 2,346,3D-structure; Alternative splicing; DNA-binding; Nucleus;Reference proteome; Transcription; Transcription regulation.,DNA-binding transcription factors
O00411,Gene Ontology,RPOM_HUMAN,"DNA-directed RNA polymerase, mitochondrial {ECO:0000305}",1230,3D-structure; Disease variant; DNA-directed RNA polymerase; Mitochondrion;Nucleotidyltransferase; Primary mitochondrial disease; Reference proteome;Transcription; Transferase; Transit peptide.,DNA replication;DNA-templated transcription
P22748,Gene Ontology,CAH4_HUMAN,Carbonic anhydrase 4,312,3D-structure; Alternative splicing; Cell membrane;Direct protein sequencing; Disease variant; Disulfide bond; Glycoprotein;GPI-anchor; Lipoprotein; Lyase; Membrane; Metal-binding;Reference proteome; Retinitis pigmentosa; Signal; Zinc.,
Q92552,BioGRID,RT27_HUMAN,Small ribosomal subunit protein mS27 {ECO:0000303|PubMed:25838379},414,3D-structure; Alternative splicing; Coiled coil; Cytoplasm; Mitochondrion;Reference proteome; Repeat; Ribonucleoprotein; Ribosomal protein;RNA-binding; rRNA-binding; Transit peptide; Translation regulation;tRNA-binding.,
Q6W2J9,Gene Ontology,BCOR_HUMAN,BCL-6 corepressor,1755,3D-structure; Acetylation; Alternative splicing; ANK repeat;Chromatin regulator; Disease variant; Isopeptide bond; Microphthalmia;Nucleus; Phosphoprotein; Reference proteome; Repeat; Repressor;Transcription; Transcription regulation; Ubl conjugation.,
Q13148,Gene Ontology,TADBP_HUMAN,TAR DNA-binding protein 43 {ECO:0000303|PubMed:7745706},414,3D-structure; Alternative splicing; Amyotrophic lateral sclerosis;Biological rhythms; Cytoplasm; Direct protein sequencing; Disease variant;DNA-binding; Isopeptide bond; Methylation; Mitochondrion; mRNA processing;mRNA splicing; Neurodegeneration; Nucleus; Phosphoprotein;Reference proteome; Repeat; Repressor; RNA-binding; Transcription;Transcription regulation; Ubl conjugation.,RNA processing
Q5FWF4,Gene Ontology,ZRAB3_HUMAN,Endonuclease ZRANB3 {ECO:0000305},1079,3D-structure; Alternative splicing; ATP-binding; Chromosome; DNA damage;DNA repair; Endonuclease; Helicase; Hydrolase; Metal-binding; Methylation;Multifunctional enzyme; Nuclease; Nucleotide-binding; Nucleus;Phosphoprotein; Reference proteome; Zinc; Zinc-finger.,Chromatin remodelers;DNA replication;DNA-modifying enzymes
Q9HD42,Gene Ontology,CHM1A_HUMAN,Charged multivesicular body protein 1a,196,3D-structure; Acetylation; Alternative splicing; Cell cycle; Cell division;Coiled coil; Cytoplasm; Endosome; Membrane; Neurodegeneration; Nucleus;Phosphoprotein; Protein transport; Reference proteome; Repressor;Transcription; Transcription regulation; Transport.,Centromere-associated
Q15797,Gene Ontology,SMAD1_HUMAN,Mothers against decapentaplegic homolog 1,465,3D-structure; Acetylation; Alternative splicing; Cytoplasm;Direct protein sequencing; DNA-binding; Metal-binding; Nucleus;Phosphoprotein; Reference proteome; Transcription;Transcription regulation; Ubl conjugation; Zinc.,Regulation of transcription;DNA-binding transcription factors;DNA-templated transcription
P22894,Gene Ontology,MMP8_HUMAN,Neutrophil collagenase,467,3D-structure; Calcium; Collagen degradation; Direct protein sequencing;Disulfide bond; Extracellular matrix; Glycoprotein; Hydrolase;Metal-binding; Metalloprotease; Protease; Reference proteome; Repeat;Secreted; Signal; Zinc; Zymogen.,
O94822,Gene Ontology,LTN1_HUMAN,E3 ubiquitin-protein ligase listerin,1766,3D-structure; Alternative splicing; Cytoplasm; Metal-binding;Reference proteome; Repeat; Transferase; Ubl conjugation;Ubl conjugation pathway; Zinc; Zinc-finger.,
Q00613,Gene Ontology,HSF1_HUMAN,Heat shock factor protein 1 {ECO:0000305},529,3D-structure; Acetylation; Activator; Alternative splicing; Centromere;Chromosome; Cytoplasm; Cytoskeleton; Direct protein sequencing; DNA damage;DNA repair; DNA-binding; Host-virus interaction; Isopeptide bond;Kinetochore; mRNA processing; mRNA transport; Nucleus; Phosphoprotein;Reference proteome; Stress response; Transcription;Transcription regulation; Transport; Ubl conjugation.,Centromere-associated;Euchromatin-associated;Heterochromatin-associated;DNA-binding transcription factors
O75382,Gene Ontology,TRIM3_HUMAN,Tripartite motif-containing protein 3,744,3D-structure; Acetylation; Alternative splicing; Cell projection;Coiled coil; Cytoplasm; Endosome; Golgi apparatus; Metal-binding;Phosphoprotein; Protein transport; Reference proteome; Repeat; Transferase;Transport; Zinc; Zinc-finger.,
P04271,Gene Ontology,S100B_HUMAN,Protein S100-B,92,3D-structure; Acetylation; Calcium; Cell adhesion; Cytoplasm;Direct protein sequencing; Metal-binding; Nucleus; Reference proteome;Repeat; Secreted; Zinc.,
Q99593,Gene Ontology,TBX5_HUMAN,T-box transcription factor TBX5,518,3D-structure; Acetylation; Alternative splicing; Atrial fibrillation;Cardiomyopathy; Cytoplasm; Developmental protein; Disease variant;DNA-binding; Nucleus; Reference proteome; Transcription;Transcription regulation.,DNA-binding transcription factors;DNA-templated transcription
O75925,Gene Ontology,PIAS1_HUMAN,E3 SUMO-protein ligase PIAS1,651,3D-structure; Acetylation; Alternative splicing; Cytoplasm; Cytoskeleton;DNA-binding; Host-virus interaction; Isopeptide bond; Metal-binding;Nucleus; Phosphoprotein; Reference proteome; Repeat; Transcription;Transcription regulation; Transferase; Ubl conjugation;Ubl conjugation pathway; Zinc; Zinc-finger.,
Q9Y2R5,BioGRID,RT17_HUMAN,Small ribosomal subunit protein uS17m {ECO:0000303|PubMed:25838379},130,3D-structure; Mitochondrion; Reference proteome; Ribonucleoprotein;Ribosomal protein; RNA-binding; rRNA-binding; Transit peptide.,
