UniProt AC,Database,Gene ID,Record Name,Amino Acids,Keywords,SimChrom
Q5VZF2,Gene Ontology,MBNL2_HUMAN,Muscleblind-like protein 2,373,3D-structure; Alternative splicing; Cytoplasm; Metal-binding;mRNA processing; mRNA splicing; Nucleus; Reference proteome; Repeat;RNA-binding; Zinc; Zinc-finger.,
Q9Y5B0,Gene Ontology,APNLITVKKY,RNA polymerase II subunit A C-terminal domain phosphatase,RKKVNHSRGT,3D-structure; Acetylation; Alternative splicing; Cataract; Cell cycle;Cell division; Cytoplasm; Cytoskeleton; Hydrolase; Mitosis; Neuropathy;Nucleus; Phosphoprotein; Protein phosphatase; Reference proteome.,DNA-templated transcription
Q9HCU9,Gene Ontology,BRMS1_HUMAN,Breast cancer metastasis-suppressor 1,246,3D-structure; Apoptosis; Coiled coil; Cytoplasm; Isopeptide bond; Nucleus;Reference proteome; Repressor; Transcription; Transcription regulation;Tumor suppressor; Ubl conjugation.,
Q96T58,Gene Ontology,MINT_HUMAN,Msx2-interacting protein,3664,3D-structure; Activator; Coiled coil; Disease variant; DNA-binding;Host-virus interaction; Intellectual disability; Methylation;Notch signaling pathway; Nucleus; Phosphoprotein; Reference proteome;Repeat; Repressor; RNA-binding; Transcription; Transcription regulation.,
Q96A58,Gene Ontology,RERG_HUMAN,Ras-related and estrogen-regulated growth inhibitor,199,3D-structure; Alternative splicing; Cytoplasm; GTP-binding; Hydrolase;Nucleotide-binding; Reference proteome.,
Q9ULV3,Gene Ontology,CIZ1_HUMAN,Cip1-interacting zinc finger protein,898,3D-structure; Alternative splicing; Disease variant; Dystonia;Isopeptide bond; Metal-binding; Nucleus; Phosphoprotein;Reference proteome; Ubl conjugation; Zinc; Zinc-finger.,
P17252,Gene Ontology,KPCA_HUMAN,Protein kinase C alpha type,672,3D-structure; Acetylation; Angiogenesis; Apoptosis; ATP-binding; Calcium;Cell adhesion; Cell membrane; Cytoplasm; Direct protein sequencing; Kinase;Membrane; Metal-binding; Mitochondrion; Nucleotide-binding; Nucleus;Phosphoprotein; Proto-oncogene; Reference proteome; Repeat;Serine/threonine-protein kinase; Transferase; Zinc; Zinc-finger.,Histone modification
P50750,Gene Ontology,CDK9_HUMAN,Cyclin-dependent kinase 9,372,3D-structure; Acetylation; Alternative splicing; ATP-binding; Cytoplasm;DNA damage; DNA repair; Host-virus interaction; Kinase; Nucleotide-binding;Nucleus; Phosphoprotein; Reference proteome;Serine/threonine-protein kinase; Transcription; Transcription regulation;Transferase; Ubl conjugation.,DNA replication;DNA-templated transcription
Q05655,BioGRID,KPCD_HUMAN,Protein kinase C delta type catalytic subunit,676,3D-structure; Alternative splicing; Apoptosis; ATP-binding; Cell cycle;Cell membrane; Cytoplasm; Kinase; Membrane; Metal-binding; Mitochondrion;Nucleotide-binding; Nucleus; Phosphoprotein; Reference proteome; Repeat;Serine/threonine-protein kinase; Transferase; Tumor suppressor; Zinc;Zinc-finger.,Histone PTM writers
Q9UER7,Gene Ontology,DAXX_HUMAN,Death domain-associated protein 6,740,3D-structure; Acetylation; Alternative splicing; Apoptosis; Centromere;Chaperone; Chromatin regulator; Chromosome; Coiled coil; Cytoplasm;Host-virus interaction; Isopeptide bond; Nucleus; Phosphoprotein;Reference proteome; Repressor; Transcription; Transcription regulation;Ubl conjugation.,Centromere-associated;Histone chaperones
Q9GZU2,Gene Ontology,PEG3_HUMAN,Paternally-expressed gene 3 protein,1588,3D-structure; Alternative splicing; Apoptosis; Cytoplasm; Metal-binding;Nucleus; Reference proteome; Repeat; Zinc; Zinc-finger.,DNA-binding transcription factors
Q14549,Gene Ontology,GBX1_HUMAN,Homeobox protein GBX-1,363,3D-structure; DNA-binding; Homeobox; Nucleus; Reference proteome;Transcription; Transcription regulation.,DNA-binding transcription factors
P46783,BioGRID,RS10_HUMAN,Small ribosomal subunit protein eS10 {ECO:0000303|PubMed:24524803},165,3D-structure; Cytoplasm; Diamond-Blackfan anemia;Direct protein sequencing; Isopeptide bond; Methylation; Nucleus;Phosphoprotein; Reference proteome; Ribonucleoprotein; Ribosomal protein;Ubl conjugation.,
Q9H6I2,Gene Ontology,SOX17_HUMAN,Transcription factor SOX-17,414,3D-structure; Activator; Disease variant; DNA-binding; Nucleus;Reference proteome; Transcription; Transcription regulation;Wnt signaling pathway.,DNA-binding transcription factors;Other families with HMG-box domain
P48436,Gene Ontology,SOX9_HUMAN,Transcription factor SOX-9 {ECO:0000305},509,3D-structure; Acetylation; Activator; Differentiation; Disease variant;DNA-binding; Isopeptide bond; Nucleus; Phosphoprotein; Reference proteome;Transcription; Transcription regulation; Ubl conjugation.,DNA-binding transcription factors;DNA-templated transcription;Other families with HMG-box domain
P51531,Gene Ontology,SMCA2_HUMAN,Probable global transcription activator SNF2L2,1590,3D-structure; Acetylation; Activator; Alternative splicing; ATP-binding;Bromodomain; Disease variant; DNA-binding; Helicase; Hydrolase;Hypotrichosis; Intellectual disability; Isopeptide bond; Neurogenesis;Nucleotide-binding; Nucleus; Phosphoprotein; Reference proteome;Schizophrenia; Transcription; Transcription regulation; Ubl conjugation.,Chromatin remodelers;DNA-modifying enzymes
P04183,Gene Ontology,KITH_HUMAN,"Thymidine kinase, cytosolic {ECO:0000305}",234,3D-structure; Acetylation; ATP-binding; Cytoplasm; DNA synthesis; Kinase;Metal-binding; Nucleotide-binding; Phosphoprotein; Reference proteome;Transferase; Ubl conjugation; Zinc.,DNA replication
Q2M1K9,Gene Ontology,ZN423_HUMAN,Zinc finger protein 423,1284,3D-structure; Activator; Alternative splicing; Ciliopathy;Developmental protein; Differentiation; Disease variant; DNA-binding;Joubert syndrome; Metal-binding; Nephronophthisis; Neurogenesis; Nucleus;Phosphoprotein; Reference proteome; Repeat; Repressor; Transcription;Transcription regulation; Zinc; Zinc-finger.,DNA-binding transcription factors
Q13948,BioGRID,CASP_HUMAN,Protein CASP,678,Alternative splicing; Coiled coil; Disulfide bond; Golgi apparatus;Membrane; Phosphoprotein; Reference proteome; Transmembrane;Transmembrane helix; Transport.,
Q02080,Gene Ontology,MEF2B_HUMAN,Myocyte-specific enhancer factor 2B,365,3D-structure; Activator; Alternative splicing; DNA-binding; Nucleus;Reference proteome; Transcription; Transcription regulation.,DNA-binding transcription factors
P28069,Gene Ontology,PIT1_HUMAN,Pituitary-specific positive transcription factor 1,291,3D-structure; Activator; Alternative splicing; Disease variant;DNA-binding; Dwarfism; Homeobox; Nucleus; Reference proteome;Transcription; Transcription regulation.,DNA-binding transcription factors
Q9C026,Gene Ontology,TRIM9_HUMAN,E3 ubiquitin-protein ligase TRIM9,710,3D-structure; Alternative splicing; Cell projection; Coiled coil;Cytoplasm; Cytoplasmic vesicle; Cytoskeleton; Metal-binding;Phosphoprotein; Reference proteome; Repeat; Synapse; Transferase;Ubl conjugation; Ubl conjugation pathway; Zinc; Zinc-finger.,
Q9Y6Q9,Gene Ontology,NCOA3_HUMAN,Nuclear receptor coactivator 3,1424,3D-structure; Acetylation; Activator; Acyltransferase;Alternative splicing; Cytoplasm; Methylation; Nucleus; Phosphoprotein;Reference proteome; Repeat; Transcription; Transcription regulation;Transferase.,Histone modification;Histone PTM writers
Q8WTS6,BioGRID,SETD7_HUMAN,Histone-lysine N-methyltransferase SETD7,366,3D-structure; Activator; Chromatin regulator; Chromosome;Direct protein sequencing; Methyltransferase; Nucleus; Reference proteome;Repeat; S-adenosyl-L-methionine; Transcription; Transcription regulation;Transferase.,Histone modification;Histone PTM writers
O00567,BioGRID,NOP56_HUMAN,Nucleolar protein 56,594,3D-structure; Acetylation; Cytoplasm; Direct protein sequencing;Isopeptide bond; Methylation; Neurodegeneration; Nucleus; Phosphoprotein;Reference proteome; Ribonucleoprotein; Ribosome biogenesis;Spinocerebellar ataxia; Ubl conjugation.,Preribosome-associated
Q9NVC6,Gene Ontology,MED17_HUMAN,Mediator of RNA polymerase II transcription subunit 17,651,3D-structure; Activator; Alternative splicing; Direct protein sequencing;Disease variant; Nucleus; Reference proteome; Transcription;Transcription regulation.,Regulation of transcription;DNA-templated transcription
P82912,BioGRID,RT11_HUMAN,Small ribosomal subunit protein uS11m {ECO:0000303|PubMed:25838379},194,3D-structure; Alternative splicing; Mitochondrion; Reference proteome;Ribonucleoprotein; Ribosomal protein; Transit peptide.,
Q5FWF5,Gene Ontology,ESCO1_HUMAN,N-acetyltransferase ESCO1,840,3D-structure; Acyltransferase; Alternative splicing; Cell cycle;Chromosome; Isopeptide bond; Metal-binding; Nucleus; Phosphoprotein;Reference proteome; Transferase; Ubl conjugation; Zinc; Zinc-finger.,
Q13342,Gene Ontology,SP140_HUMAN,Nuclear body protein SP140 {ECO:0000312|HGNC:HGNC:17133},867,3D-structure; Alternative splicing; Bromodomain; Cytoplasm; DNA-binding;Metal-binding; Nucleus; Phosphoprotein; Reference proteome; Zinc;Zinc-finger.,DNA-binding transcription factors
O75469,Gene Ontology,NR1I2_HUMAN,Nuclear receptor subfamily 1 group I member 2,434,3D-structure; Activator; Alternative splicing; DNA-binding; Metal-binding;Nucleus; Receptor; Reference proteome; Transcription;Transcription regulation; Zinc; Zinc-finger.,Nuclear hormone receptors;DNA-binding transcription factors
Q13029,Gene Ontology,PRDM2_HUMAN,PR domain zinc finger protein 2,1718,3D-structure; Activator; Alternative initiation; Alternative splicing;DNA-binding; Isopeptide bond; Metal-binding; Methyltransferase; Nucleus;Phosphoprotein; Reference proteome; Repeat; S-adenosyl-L-methionine;Transcription; Transcription regulation; Transferase; Ubl conjugation;Zinc; Zinc-finger.,Histone modification;Histone PTM writers;DNA-binding transcription factors
P35869,Gene Ontology,AHR_HUMAN,Aryl hydrocarbon receptor {ECO:0000303|PubMed:8393992},848,3D-structure; Acetylation; Activator; ADP-ribosylation; Biological rhythms;Cell cycle; Cytoplasm; DNA-binding; Nucleus; Receptor; Reference proteome;Repeat; Repressor; Retinitis pigmentosa; Transcription;Transcription regulation.,Nuclear hormone receptors;DNA-binding transcription factors
P16401,Gene Ontology,H15_HUMAN,Histone H1.5,226,3D-structure; Acetylation; Chromosome; Citrullination;Direct protein sequencing; DNA-binding; Hydroxylation; Methylation;Nucleus; Phosphoprotein; Reference proteome.,Histones
Q9Y3R0,Gene Ontology,GRIP1_HUMAN,Glutamate receptor-interacting protein 1,1128,3D-structure; Alternative splicing; Cell membrane; Cell projection;Cytoplasm; Cytoplasmic vesicle; Endoplasmic reticulum; Membrane;Phosphoprotein; Postsynaptic cell membrane; Reference proteome; Repeat;Synapse.,
Q9Y261,Gene Ontology,FOXA2_HUMAN,Hepatocyte nuclear factor 3-beta,457,3D-structure; Activator; Alternative splicing; Chromatin regulator;Cytoplasm; Developmental protein; DNA-binding; Nucleus; Phosphoprotein;Reference proteome; Transcription; Transcription regulation.,DNA-binding transcription factors;Pioneer TFs
Q14188,Gene Ontology,TFDP2_HUMAN,Transcription factor Dp-2,446,3D-structure; Acetylation; Activator; Alternative splicing; Cell cycle;DNA-binding; Nucleus; Phosphoprotein; Reference proteome; Transcription;Transcription regulation.,Regulation of transcription;DNA-binding transcription factors
Q14814,Gene Ontology,MEF2D_HUMAN,Myocyte-specific enhancer factor 2D,521,3D-structure; Acetylation; Activator; Alternative splicing; Apoptosis;Developmental protein; Differentiation; DNA-binding; Isopeptide bond;Neurogenesis; Nucleus; Phosphoprotein; Reference proteome; Transcription;Transcription regulation; Ubl conjugation.,DNA-binding transcription factors
P13716,Gene Ontology,HEM2_HUMAN,Delta-aminolevulinic acid dehydratase,330,3D-structure; Allosteric enzyme; Alternative splicing;Direct protein sequencing; Disease variant; Heme biosynthesis; Lyase;Metal-binding; Phosphoprotein; Porphyrin biosynthesis; Reference proteome;Zinc.,
P48443,Gene Ontology,RXRG_HUMAN,Retinoic acid receptor RXR-gamma,463,3D-structure; Acetylation; Cytoplasm; DNA-binding; Metal-binding; Nucleus;Receptor; Reference proteome; Transcription; Transcription regulation;Zinc; Zinc-finger.,Nuclear hormone receptors;Regulation of transcription;DNA-binding transcription factors
Q9UDY6,Gene Ontology,TRI10_HUMAN,Tripartite motif-containing protein 10,481,3D-structure; Alternative splicing; Coiled coil; Cytoplasm; Metal-binding;Reference proteome; Zinc; Zinc-finger.,
P32780,Gene Ontology,TF2H1_HUMAN,General transcription factor IIH subunit 1,548,3D-structure; Acetylation; Alternative splicing; DNA damage; DNA repair;Host-virus interaction; Nucleus; Phosphoprotein; Reference proteome;Repeat; Transcription; Transcription regulation.,DNA repair;Regulation of transcription;General TFs;DNA-templated transcription
Q9NVI7,BioGRID,ATD3A_HUMAN,ATPase family AAA domain-containing protein 3A {ECO:0000312|HGNC:HGNC:25567},634,Acetylation; Alternative splicing; ATP-binding; Coiled coil;Direct protein sequencing; Disease variant; Membrane; Mitochondrion;Mitochondrion inner membrane; Mitochondrion nucleoid; Nucleotide-binding;Phosphoprotein; Reference proteome; Transmembrane; Transmembrane helix.,
P01100,Gene Ontology,FOS_HUMAN,Protein c-Fos {ECO:0000305},380,3D-structure; Alternative splicing; Cytoplasm; DNA-binding;Endoplasmic reticulum; Isopeptide bond; Nucleus; Phosphoprotein;Proto-oncogene; Reference proteome; Ubl conjugation.,Regulation of transcription;DNA-binding transcription factors;DNA-templated transcription
Q99626,Gene Ontology,CDX2_HUMAN,Homeobox protein CDX-2,313,3D-structure; Activator; Developmental protein; DNA-binding; Homeobox;Nucleus; Phosphoprotein; Reference proteome; Transcription;Transcription regulation; Ubl conjugation.,Methylated DNA binding;DNA-binding transcription factors
P09238,Gene Ontology,MMP10_HUMAN,Stromelysin-2,476,3D-structure; Calcium; Collagen degradation; Disulfide bond;Extracellular matrix; Hydrolase; Metal-binding; Metalloprotease; Protease;Reference proteome; Repeat; Secreted; Signal; Zinc; Zymogen.,
O15353,Gene Ontology,FOXN1_HUMAN,Forkhead box protein N1,648,3D-structure; Developmental protein; Differentiation; Disease variant;DNA-binding; Hypotrichosis; Nucleus; Reference proteome; Transcription;Transcription regulation.,DNA-binding transcription factors
P10276,Gene Ontology,RARA_HUMAN,Retinoic acid receptor alpha,462,3D-structure; Alternative splicing; Chromosomal rearrangement; Cytoplasm;DNA-binding; Isopeptide bond; Metal-binding; Nucleus; Phosphoprotein;Proto-oncogene; Receptor; Reference proteome; Transcription;Transcription regulation; Ubl conjugation; Zinc; Zinc-finger.,Nuclear hormone receptors;Regulation of transcription;DNA-binding transcription factors;DNA-templated transcription
Q8IYH5,Gene Ontology,ZZZ3_HUMAN,ZZ-type zinc finger-containing protein 3,903,3D-structure; Acetylation; Alternative splicing; DNA-binding;Isopeptide bond; Metal-binding; Nucleus; Phosphoprotein;Reference proteome; Transcription; Transcription regulation;Ubl conjugation; Zinc; Zinc-finger.,Histone PTM readers
P16444,Gene Ontology,DPEP1_HUMAN,Dipeptidase 1,411,3D-structure; Cell membrane; Cell projection; Dipeptidase;Direct protein sequencing; Disulfide bond; Glycoprotein; GPI-anchor;Hydrolase; Lipid metabolism; Lipoprotein; Membrane; Metal-binding;Metalloprotease; Protease; Reference proteome; Signal; Zinc.,
P46531,Gene Ontology,NOTC1_HUMAN,Notch 1 intracellular domain,2555,3D-structure; Activator; Angiogenesis; ANK repeat; Calcium; Cell membrane;Developmental protein; Differentiation; Direct protein sequencing;Disease variant; Disulfide bond; EGF-like domain; Glycoprotein;Hydroxylation; Isopeptide bond; Membrane; Metal-binding;Notch signaling pathway; Nucleus; Phosphoprotein; Receptor;Reference proteome; Repeat; Signal; Transcription;Transcription regulation; Transmembrane; Transmembrane helix;Ubl conjugation.,DNA-binding transcription factors;DNA-templated transcription
P42226,Gene Ontology,STAT6_HUMAN,Signal transducer and activator of transcription 6,847,3D-structure; Acetylation; Activator; ADP-ribosylation;Alternative splicing; Cytoplasm; DNA-binding; Nucleus; Phosphoprotein;Reference proteome; SH2 domain; Transcription; Transcription regulation.,Regulation of transcription;DNA-binding transcription factors
Q6R6M4,BioGRID,U17L2_HUMAN,Ubiquitin carboxyl-terminal hydrolase 17,530,Apoptosis; Cell cycle; Endoplasmic reticulum; Hydrolase; Nucleus; Protease;Reference proteome; Thiol protease; Ubl conjugation pathway.,
P07910,Gene Ontology,HNRPC_HUMAN,Heterogeneous nuclear ribonucleoproteins C1/C2,306,3D-structure; Acetylation; Alternative splicing; Coiled coil;Direct protein sequencing; Isopeptide bond; mRNA processing; mRNA splicing;Nucleus; Phosphoprotein; Reference proteome; Ribonucleoprotein;RNA-binding; Spliceosome; Ubl conjugation.,RNA processing
P23497,Gene Ontology,SP100_HUMAN,Nuclear autoantigen Sp-100,879,3D-structure; Acetylation; Alternative splicing; Coiled coil; Cytoplasm;DNA-binding; Host-virus interaction; Isopeptide bond; Nucleus;Phosphoprotein; Reference proteome; Repeat; Transcription;Transcription regulation; Ubl conjugation.,Telomere-associated;DNA-binding transcription factors
P35680,Gene Ontology,HNF1B_HUMAN,Hepatocyte nuclear factor 1-beta,557,3D-structure; Activator; Alternative splicing; Diabetes mellitus;Disease variant; DNA-binding; Homeobox; Nucleus; Phosphoprotein;Reference proteome; Transcription; Transcription regulation.,DNA-binding transcription factors
Q9UJA9,Gene Ontology,ENPP5_HUMAN,Ectonucleotide pyrophosphatase/phosphodiesterase family member 5,477,3D-structure; Glycoprotein; Hydrolase; Membrane; Metal-binding;Reference proteome; Secreted; Signal; Transmembrane; Transmembrane helix;Zinc.,
P56915,Gene Ontology,GSC_HUMAN,Homeobox protein goosecoid,257,3D-structure; Developmental protein; DNA-binding; Dwarfism; Homeobox;Nucleus; Reference proteome.,DNA-binding transcription factors
O15294,Gene Ontology,DNRIVLNGID,UDP-N-acetylglucosamine--peptide N-acetylglucosaminyltransferase 110 kDa subunit,GGDNADSSNT,3D-structure; Acetylation; Alternative splicing; Apoptosis;Biological rhythms; Cell membrane; Cell projection; Chromatin regulator;Cytoplasm; Direct protein sequencing; Disease variant; Glycoprotein;Glycosyltransferase; Host-virus interaction; Intellectual disability;Lipid-binding; Membrane; Mitochondrion; Nucleus; Phosphoprotein;Reference proteome; Repeat; TPR repeat; Transferase; Ubl conjugation;Ubl conjugation pathway.,
Q9NWT6,Gene Ontology,HIF1N_HUMAN,Hypoxia-inducible factor 1-alpha inhibitor,349,3D-structure; Acetylation; Cytoplasm; Dioxygenase; Iron; Metal-binding;Nucleus; Oxidoreductase; Reference proteome; Transcription;Transcription regulation.,
P10828,Gene Ontology,THB_HUMAN,Thyroid hormone receptor beta,461,3D-structure; Alternative splicing; Deafness; Disease variant; DNA-binding;Metal-binding; Nucleus; Receptor; Reference proteome; Transcription;Transcription regulation; Zinc; Zinc-finger.,Nuclear hormone receptors;Regulation of transcription;DNA-binding transcription factors;DNA-templated transcription
P82663,BioGRID,RT25_HUMAN,Small ribosomal subunit protein mS25 {ECO:0000303|PubMed:25838379},173,3D-structure; Alternative splicing; Disease variant; Mitochondrion;Primary mitochondrial disease; Reference proteome; Ribonucleoprotein;Ribosomal protein.,
Q4VC05,BioGRID,BCL7A_HUMAN,B-cell CLL/lymphoma 7 protein family member A,210,Alternative splicing; Chromosomal rearrangement; Isopeptide bond;Phosphoprotein; Reference proteome; Ubl conjugation.,Chromatin remodelers
P51843,Gene Ontology,NR0B1_HUMAN,Nuclear receptor subfamily 0 group B member 1,470,3D-structure; Alternative splicing; Cytoplasm; Disease variant; Nucleus;Receptor; Reference proteome; Repeat; Repressor; Transcription;Transcription regulation.,
O95071,Gene Ontology,UBR5_HUMAN,E3 ubiquitin-protein ligase UBR5,2799,3D-structure; Acetylation; Alternative splicing; DNA damage; DNA repair;Host-virus interaction; Metal-binding; Nucleus; Phosphoprotein;Reference proteome; Transferase; Ubl conjugation pathway; Zinc;Zinc-finger.,
O00488,Gene Ontology,ZN593_HUMAN,Zinc finger protein 593,134,3D-structure; Cytoplasm; DNA-binding; Metal-binding; Nucleus;Reference proteome; Ribosome biogenesis; Transcription;Transcription regulation; Zinc; Zinc-finger.,
Q9Y399,BioGRID,RT02_HUMAN,Small ribosomal subunit protein uS2m {ECO:0000303|PubMed:25838379},296,3D-structure; Disease variant; Mitochondrion;Primary mitochondrial disease; Reference proteome; Ribonucleoprotein;Ribosomal protein.,
Q99707,Gene Ontology,METH_HUMAN,Methionine synthase {ECO:0000303|PubMed:8968737},1265,3D-structure; Alternative splicing; Amino-acid biosynthesis; Cobalamin;Cobalt; Cytoplasm; Disease variant; Metal-binding; Methionine biosynthesis;Methyltransferase; Phosphoprotein; Reference proteome; Repeat;S-adenosyl-L-methionine; Transferase; Zinc.,
O75398,Gene Ontology,DEAF1_HUMAN,Deformed epidermal autoregulatory factor 1 homolog,565,3D-structure; Alternative splicing; Cytoplasm; Developmental protein;Disease variant; DNA-binding; Epilepsy; Intellectual disability;Metal-binding; Neurogenesis; Nucleus; Phosphoprotein; Reference proteome;Secreted; Transcription; Transcription regulation; Zinc; Zinc-finger.,DNA-binding transcription factors;DNA-templated transcription
P23415,Gene Ontology,GLRA1_HUMAN,Glycine receptor subunit alpha-1,457,3D-structure; Alternative splicing; Cell membrane; Cell projection;Chloride; Chloride channel; Disease variant; Disulfide bond; Glycoprotein;Ion channel; Ion transport; Ligand-gated ion channel; Membrane;Metal-binding; Postsynaptic cell membrane; Receptor; Reference proteome;Signal; Synapse; Transmembrane; Transmembrane helix; Transport; Zinc.,
Q8TDB6,Gene Ontology,DTX3L_HUMAN,E3 ubiquitin-protein ligase DTX3L,740,3D-structure; Acetylation; Alternative splicing; Antiviral defense;Chromatin regulator; Cytoplasm; DNA damage; DNA repair; Endosome;Host-virus interaction; Immunity; Innate immunity; Lysosome; Membrane;Metal-binding; Nucleus; Phosphoprotein; Protein transport;Reference proteome; Transferase; Transport; Ubl conjugation;Ubl conjugation pathway; Zinc; Zinc-finger.,Histone modification;Histone PTM writers;DNA repair
Q6NS38,Gene Ontology,ALKB2_HUMAN,DNA oxidative demethylase ALKBH2,261,3D-structure; Alternative splicing; Dioxygenase; DNA damage; DNA repair;Iron; Magnesium; Metal-binding; Nucleus; Oxidoreductase;Reference proteome.,DNA repair;DNA-modifying enzymes;DNA de_methylation
O60481,Gene Ontology,ZIC3_HUMAN,Zinc finger protein ZIC 3,467,3D-structure; Activator; Alternative splicing; Cytoplasm;Developmental protein; Differentiation; Disease variant; DNA-binding;Heterotaxy; Isopeptide bond; Metal-binding; Neurogenesis; Nucleus;Reference proteome; Repeat; Transcription; Transcription regulation;Triplet repeat expansion; Ubl conjugation; Zinc; Zinc-finger.,DNA-binding transcription factors;DNA-templated transcription
O60341,Gene Ontology,KDM1A_HUMAN,Lysine-specific histone demethylase 1A {ECO:0000305},852,3D-structure; Alternative splicing; Chromatin regulator; Coiled coil;Developmental protein; Direct protein sequencing; Disease variant; FAD;Flavoprotein; Isopeptide bond; Nucleus; Oxidoreductase; Phosphoprotein;Reference proteome; Repressor; Transcription; Transcription regulation;Ubl conjugation.,Histone modification;Histone PTM erasers;DNA repair;Telomere-associated
Q6P1X5,Gene Ontology,TAF2_HUMAN,Transcription initiation factor TFIID subunit 2,1199,3D-structure; Disease variant; Intellectual disability; Nucleus;Phosphoprotein; Reference proteome; Transcription;Transcription regulation.,Regulation of transcription;General TFs;DNA-templated transcription
O95999,Gene Ontology,BCL10_HUMAN,B-cell lymphoma/leukemia 10,233,3D-structure; Acetylation; Adaptive immunity; Apoptosis;Chromosomal rearrangement; Cytoplasm; Disease variant; Immunity;Innate immunity; Isopeptide bond; Membrane; Phosphoprotein;Reference proteome; Tumor suppressor; Ubl conjugation.,
O75164,Gene Ontology,KDM4A_HUMAN,Lysine-specific demethylase 4A,1064,3D-structure; Acetylation; Alternative splicing; Chromatin regulator;Dioxygenase; Host-virus interaction; Iron; Isopeptide bond; Metal-binding;Nucleus; Oxidoreductase; Phosphoprotein; Reference proteome; Repeat;Transcription; Transcription regulation; Ubl conjugation; Zinc;Zinc-finger.,Histone PTM readers;Histone modification;Histone PTM erasers;Centromere-associated;Heterochromatin-associated
P09525,Gene Ontology,ANXA4_HUMAN,Annexin A4 {ECO:0000305},319,3D-structure; Acetylation; Alternative initiation; Alternative splicing;Annexin; Calcium; Calcium/phospholipid-binding; Cytoplasmic vesicle;Direct protein sequencing; Membrane; Phosphoprotein; Reference proteome;Repeat.,
O43763,Gene Ontology,TLX2_HUMAN,T-cell leukemia homeobox protein 2,284,3D-structure; Activator; Developmental protein; DNA-binding; Homeobox;Nucleus; Reference proteome; Transcription; Transcription regulation.,DNA-binding transcription factors
P49768,Gene Ontology,PSN1_HUMAN,Presenilin-1 CTF12,467,3D-structure; Alternative splicing; Alzheimer disease; Amyloidosis;Apoptosis; Cardiomyopathy; Cell adhesion; Cell membrane; Cell projection;Direct protein sequencing; Disease variant; Endoplasmic reticulum;Endosome; Golgi apparatus; Hydrolase; Membrane; Neurodegeneration;Notch signaling pathway; Phosphoprotein; Protease; Reference proteome;Synapse; Transmembrane; Transmembrane helix.,Centromere-associated
Q53GS9,Gene Ontology,UBP39_HUMAN,Ubiquitin carboxyl-terminal hydrolase 39 {ECO:0000303|PubMed:30771428},565,3D-structure; Alternative splicing; Cell cycle; Cell division; Hydrolase;Isopeptide bond; Metal-binding; mRNA processing; mRNA splicing; Nucleus;Phosphoprotein; Reference proteome; Spliceosome; Ubl conjugation;Ubl conjugation pathway; Zinc; Zinc-finger.,
